root@comp3134-Winter2024:~# tcpdump -c 5 -i eth0
tcpdump: verbose output suppressed, use -v[v]... for full protocol decode
listening on eth0, link-type EN10MB (Ethernet), snapshot length 262144 bytes
02:05:30.058557 IP 141.117.117.234.13056 > comp3134-Winter2024.ssh: Flags [.], ack 1886125380, win 2047, options [nop,nop,TS val 1725409031 ecr 2951390486], length 0
02:05:30.059602 IP comp3134-Winter2024.ssh > 141.117.117.234.13056: Flags [P.], seq 1:109, ack 0, win 501, options [nop,nop,TS val 2951390492 ecr 1725409031], length 108
02:05:30.059670 IP comp3134-Winter2024.ssh > 141.117.117.234.13056: Flags [P.], seq 109:145, ack 0, win 501, options [nop,nop,TS val 2951390492 ecr 1725409031], length 36
02:05:30.059703 IP comp3134-Winter2024.ssh > 141.117.117.234.13056: Flags [P.], seq 145:197, ack 0, win 501, options [nop,nop,TS val 2951390492 ecr 1725409031], length 52
02:05:30.059735 IP comp3134-Winter2024.ssh > 141.117.117.234.13056: Flags [P.], seq 197:265, ack 0, win 501, options [nop,nop,TS val 2951390492 ecr 1725409031], length 68
5 packets captured
36 packets received by filter
0 packets dropped by kernel