root@comp3134-Winter2024:~# tcpdump -A -i eth0
tcpdump: verbose output suppressed, use -v[v]... for full protocol decode
listening on eth0, link-type EN10MB (Ethernet), snapshot length 262144 bytes
02:06:20.258167 IP comp3134-Winter2024.ssh > 141.117.117.234.13056: Flags [P.], seq 1886128336:1886128444, ack 3369855614, win 501, options [nop,nop,TS val 2951440690 ecr 1725458972], length 108
E...\.@.@.(...!..uu...3.pl.....~...........
..i2f.j..cn3........o.......>j....;...=.0.......).89_>..v.~j.sq.y.O..k.>.._t..c...r.`B.....2at.:....a....3..`H...=.(
02:06:20.258256 IP comp3134-Winter2024.ssh > 141.117.117.234.13056: Flags [P.], seq 108:144, ack 1, win 501, options [nop,nop,TS val 2951440691 ecr 1725458972], length 36
E..X\.@.@.(...!..uu...3.pl	<...~.....[.....
..i3f.j....KU6#..uNBS..a5. .j.!.........'O..
02:06:20.258314 IP comp3134-Winter2024.ssh > 141.117.117.234.13056: Flags [P.], seq 144:196, ack 1, win 501, options [nop,nop,TS val 2951440691 ecr 1725458972], length 52
E..h\.@.@.(...!..uu...3.pl	`...~.....k.....
..i3f.j...C.V.E...=..........p......Y...-pU.k.....e..8<V....
02:06:20.258359 IP comp3134-Winter2024.ssh > 141.117.117.234.13056: Flags [P.], seq 196:264, ack 1, win 501, options [nop,nop,TS val 2951440691 ecr 1725458972], length 68
E..x\.@.@.(...!..uu...3.pl	....~.....{.....
..i3f.j......3......>..S...+[.t...8........
+N..H.*.xz....S..9.>...5.5.q.!..
02:06:20.258415 IP comp3134-Winter2024.ssh > 141.117.117.234.13056: Flags [P.], seq 264:332, ack 1, win 501, options [nop,nop,TS val 2951440691 ecr 1725458972], length 68
E..x\.@.@.(...!..uu...3.pl	....~.....{.....
..i3f.j...L!..H.f'....V...&..v.......j..fu.+.n&#.D.i.^...R$Py.|"!..>..g.8n.*
02:06:20.258458 IP comp3134-Winter2024.ssh > 141.117.117.234.13056: Flags [P.], seq 332:368, ack 1, win 501, options [nop,nop,TS val 2951440691 ecr 1725458972], length 36
E..X\.@.@.(...!..uu...3.pl
....~.....[.....
..i3f.j.S...9EGm&.>.1-.@.z.$<W~m....k..?.'..
02:06:20.260156 IP 141.117.117.234.13056 > comp3134-Winter2024.ssh: Flags [.], ack 0, win 2047, options [nop,nop,TS val 1725459231 ecr 2951440687], length 0
EH.4..@.7..k.uu...!.3......~pl......n......
f.k...i/
02:06:20.263635 IP 141.117.117.234.13056 > comp3134-Winter2024.ssh: Flags [.], ack 368, win 2042, options [nop,nop,TS val 1725459235 ecr 2951440691], length 0
EH.4..@.7..k.uu...!.3......~pl
@....mz.....
f.k#..i3
02:06:20.358015 IP comp3134-Winter2024.41558 > 67.207.67.3.domain: 54574+ [1au] PTR? 234.117.117.141.in-addr.arpa. (57)
E..U.*..@.....!.C.C..V.5.A8..............234.117.117.141.in-addr.arpa.......)........
02:06:20.358472 IP comp3134-Winter2024.46369 > 67.207.67.3.domain: 64510+ [1au] PTR? 234.117.117.141.in-addr.arpa. (57)
E..U....@.nY..!.C.C..!.5.A8..............234.117.117.141.in-addr.arpa.......)........
02:06:20.358739 IP comp3134-Winter2024.55060 > 67.207.67.2.domain: Flags [S], seq 1442990589, win 64240, options [mss 1460,sackOK,TS val 3772704012 ecr 0,nop,wscale 7,tfo  cookiereq,nop,nop], length 0
E..@d.@.@..n..!.C.C....5V.I.........8..........
............"...
02:06:20.359885 IP 67.207.67.3.domain > comp3134-Winter2024.41558: 54574 NXDomain 0/1/1 (124)
E....h..<..iC.C...!..5.V.................234.117.117.141.in-addr.arpa................7.extns1.ryerson.ca..noc	torontomu.Iw.X...........Q.......)........
02:06:20.359918 IP 67.207.67.3.domain > comp3134-Winter2024.46369: 64510 NXDomain 0/1/1 (124)
E.......<.q.C.C...!..5.!..p..............234.117.117.141.in-addr.arpa................7.extns1.ryerson.ca..noc	torontomu.Iw.X...........Q.......)........
02:06:20.360101 IP comp3134-Winter2024.41558 > 67.207.67.3.domain: 54574+ PTR? 234.117.117.141.in-addr.arpa. (46)
E..J.+..@.....!.C.C..V.5.68..............234.117.117.141.in-addr.arpa.....
02:06:20.360153 IP comp3134-Winter2024.46369 > 67.207.67.3.domain: 64510+ PTR? 234.117.117.141.in-addr.arpa. (46)
E..J....@.nc..!.C.C..!.5.68..............234.117.117.141.in-addr.arpa.....
02:06:20.360470 IP 67.207.67.3.domain > comp3134-Winter2024.46369: 64510 NXDomain 0/1/0 (113)
E.......<.q.C.C...!..5.!.ys..............234.117.117.141.in-addr.arpa................7.extns1.ryerson.ca..noc	torontomu.Iw.X...........Q.....
02:06:20.360518 IP 67.207.67.2.domain > comp3134-Winter2024.55060: Flags [S.], seq 3458151346, ack 1442990590, win 65160, options [mss 1460,sackOK,TS val 1773115569 ecr 3772704012,nop,wscale 9], length 0
E..<..@.<..:C.C...!..5....3.V.I......y.........
i..........
02:06:20.360549 IP comp3134-Winter2024.55060 > 67.207.67.2.domain: Flags [.], ack 1, win 502, options [nop,nop,TS val 3772704014 ecr 1773115569], length 0
E..4d.@.@..y..!.C.C....5V.I...3.....8......
....i...
02:06:20.360563 IP 67.207.67.3.domain > comp3134-Winter2024.41558: 54574 NXDomain 0/1/0 (113)
E....i..<..sC.C...!..5.V.y.
.............234.117.117.141.in-addr.arpa................7.extns1.ryerson.ca..noc	torontomu.Iw.X...........Q.....
02:06:20.360610 IP comp3134-Winter2024.55060 > 67.207.67.2.domain: Flags [P.], seq 1:49, ack 1, win 502, options [nop,nop,TS val 3772704014 ecr 1773115569], length 48 3054+ PTR? 234.117.117.141.in-addr.arpa. (46)
E..dd.@.@..H..!.C.C....5V.I...3.....8......
....i..................234.117.117.141.in-addr.arpa.....
02:06:20.361004 IP 67.207.67.2.domain > comp3134-Winter2024.55060: Flags [.], ack 49, win 128, options [nop,nop,TS val 1773115570 ecr 3772704014], length 0
E..4/U@.<...C.C...!..5....3.V.J............
i.......
02:06:20.361857 IP 67.207.67.2.domain > comp3134-Winter2024.55060: Flags [P.], seq 1:116, ack 49, win 128, options [nop,nop,TS val 1773115571 ecr 3772704014], length 115 3054 NXDomain 0/1/0 (113)
E.../V@.<..xC.C...!..5....3.V.J.....M......
i........q.............234.117.117.141.in-addr.arpa................7.extns1.ryerson.ca..noc	torontomu.Iw.X...........Q.....
02:06:20.361888 IP comp3134-Winter2024.55060 > 67.207.67.2.domain: Flags [.], ack 116, win 502, options [nop,nop,TS val 3772704015 ecr 1773115571], length 0
E..4d.@.@..w..!.C.C....5V.J...4&....8......
....i...
02:06:20.362580 IP comp3134-Winter2024.57687 > 67.207.67.3.domain: 57421+ [1au] PTR? 235.33.198.143.in-addr.arpa. (56)
E..TD...@.....!.C.C..W.5.@8..M...........235.33.198.143.in-addr.arpa.......)........
02:06:20.363058 IP 67.207.67.3.domain > comp3134-Winter2024.57687: 57421 NXDomain 0/1/1 (123)
E.......<.q.C.C...!..5.W...h.M...........235.33.198.143.in-addr.arpa..............6.7.ns1.digitalocean.com.
hostmaster..e.y...*0.....	:.......)........
02:06:20.363199 IP comp3134-Winter2024.57687 > 67.207.67.3.domain: 57421+ PTR? 235.33.198.143.in-addr.arpa. (45)
E..ID...@.....!.C.C..W.5.58..M...........235.33.198.143.in-addr.arpa.....
02:06:20.363538 IP 67.207.67.3.domain > comp3134-Winter2024.57687: 57421 NXDomain 0/1/0 (112)
E.......<.q.C.C...!..5.W.x...M...........235.33.198.143.in-addr.arpa..............6.7.ns1.digitalocean.com.
hostmaster..e.y...*0.....	:.....
02:06:20.364079 IP comp3134-Winter2024.ssh > 141.117.117.234.13056: Flags [P.], seq 368:596, ack 1, win 501, options [nop,nop,TS val 2951440796 ecr 1725459235], length 228
E...\.@.@.($..!..uu...3.pl
@...~...........
..i.f.k#:.g....TC.....*..r....F.j.[A.}..{).>......nSw..Z....V.I..y,`...wg.....	.....~...5......X..............m..I...&am.........[....K.N..Z.?J.c.b...]1..P3.WP...........?g.o~......3D0+..{.&.....K...o..\..}.....~F..?r.R.J...jo.N<H.@.L.,
02:06:20.364209 IP comp3134-Winter2024.ssh > 141.117.117.234.13056: Flags [P.], seq 596:908, ack 1, win 501, options [nop,nop,TS val 2951440796 ecr 1725459235], length 312
E..l\.@.@.'...!..uu...3.pl.$...~.....o.....
..i.f.k#..%....U....y.n.5...p......&".). S.......@.-
..u..\ZHw.V..1.q0..3....-x/....v.../i/....O| .'..zP...X.DnZfi.
..R...bJ[....:..w.......iC6t..z+8....I.....k.......=T..`!.<...&.~...)..
g:.... ...4
....!....].<L.......3M;.=}j.|7$.	.Q......#+..E..S0.G.h..cj(`#.-..3=..........?.3Z...)F.(`....v......."!$|..........}/#..
02:06:20.364256 IP comp3134-Winter2024.ssh > 141.117.117.234.13056: Flags [P.], seq 908:944, ack 1, win 501, options [nop,nop,TS val 2951440797 ecr 1725459235], length 36
E..X\.@.@.(...!..uu...3.pl.\...~.....[.....
..i.f.k#<.9.._.X.|u.s|I?5z.....4'......f1...
02:06:20.364329 IP comp3134-Winter2024.ssh > 141.117.117.234.13056: Flags [P.], seq 944:1148, ack 1, win 501, options [nop,nop,TS val 2951440797 ecr 1725459235], length 204
E...\.@.@.(9..!..uu...3.pl.....~...........
..i.f.k#~\.8%......IIK1..d.gM..!..?.t......U.9...[@q.!.7.O.V.O$T.&....RI.`..g...!..C.)...5..s=.}. .~..N..tJ....s.N.vo.Q&......O.*/!..eL...	........fz.>6.......X.....(......._'.n..<p).... ...d&.%~.Eu.N.X"....kpP..
02:06:20.364433 IP comp3134-Winter2024.ssh > 141.117.117.234.13056: Flags [P.], seq 1148:1332, ack 1, win 501, options [nop,nop,TS val 2951440797 ecr 1725459235], length 184
E...\.@.@.(L..!..uu...3.pl.L...~...........
..i.f.k#ss3.n..........l..O..gsMH.5....K.Q..V..C.)IO...T.[..rh.0^....w.z.t.[r.j.?m.	cb.l^..R...G.*~....ki....y>.......YSK.f...7qx.{".,@.)o.".E8.e.G..D.......n.....P....f.....Fn....)........a.J
02:06:20.364457 IP comp3134-Winter2024.ssh > 141.117.117.234.13056: Flags [P.], seq 1332:1368, ack 1, win 501, options [nop,nop,TS val 2951440797 ecr 1725459235], length 36
E..X\.@.@.(...!..uu...3.pl.....~.....[.....
..i.f.k#>..t(.......Ke.>-.o.9b).B6...Y..t|..
02:06:20.364516 IP comp3134-Winter2024.ssh > 141.117.117.234.13056: Flags [P.], seq 1368:1452, ack 1, win 501, options [nop,nop,TS val 2951440797 ecr 1725459235], length 84
E...\.@.@.(...!..uu...3.pl.(...~...........
..i.f.k#..#[..M[....0cO...w\.xsl....6..#..........H.=.	&.ny.\..y......C.[.>..f...)....w.-...
02:06:20.364550 IP comp3134-Winter2024.ssh > 141.117.117.234.13056: Flags [P.], seq 1452:1488, ack 1, win 501, options [nop,nop,TS val 2951440797 ecr 1725459235], length 36
E..X\.@.@.(...!..uu...3.pl.|...~.....[.....
..i.f.k#..*/g.y....RR!...VwL..)y.Y.n.4.u.{..
02:06:20.364605 IP comp3134-Winter2024.ssh > 141.117.117.234.13056: Flags [P.], seq 1488:1692, ack 1, win 501, options [nop,nop,TS val 2951440797 ecr 1725459235], length 204
E...\.@.@.(4..!..uu...3.pl.....~...........
..i.f.k#._....Vs.....2.......[.l.c!WC.......C%.......X.d......../eo.0v...K,0g.P.g9.....w.;...._\.n........NCFi./c.kFp..	...|...e8S........[>X.........P....r.w.'.y..........+.X.K.I.c,..?2.j<..d,..m.0....<.Z.....9.
02:06:20.364637 IP comp3134-Winter2024.ssh > 141.117.117.234.13056: Flags [P.], seq 1692:1728, ack 1, win 501, options [nop,nop,TS val 2951440797 ecr 1725459235], length 36
E..X\.@.@.(...!..uu...3.pl.l...~.....[.....
..i.f.k#W....#....<h.....jXg....].INM..}+...
02:06:20.364675 IP comp3134-Winter2024.ssh > 141.117.117.234.13056: Flags [P.], seq 1728:1788, ack 1, win 501, options [nop,nop,TS val 2951440797 ecr 1725459235], length 60
E..p\.@.@.(...!..uu...3.pl.....~.....s.....
..i.f.k#....U.$......,....3Cc.|............/.....a..X.5.O...`o..	.?/
02:06:20.364707 IP comp3134-Winter2024.ssh > 141.117.117.234.13056: Flags [P.], seq 1788:1824, ack 1, win 501, options [nop,nop,TS val 2951440797 ecr 1725459235], length 36
E..X\.@.@.(...!..uu...3.pl.....~.....[.....
..i.f.k#.1kx.H...}...Z..VR.S..}:.n*9^A;..h..
02:06:20.364736 IP comp3134-Winter2024.ssh > 141.117.117.234.13056: Flags [P.], seq 1824:1876, ack 1, win 501, options [nop,nop,TS val 2951440797 ecr 1725459235], length 52
E..h\.@.@.(...!..uu...3.pl.....~.....k.....
..i.f.k#...J.Z..~..{....>R...........i...J. ......L....g....
02:06:20.364766 IP comp3134-Winter2024.ssh > 141.117.117.234.13056: Flags [P.], seq 1876:1912, ack 1, win 501, options [nop,nop,TS val 2951440797 ecr 1725459235], length 36
E..X\.@.@.(...!..uu...3.pl.$...~.....[.....
..i.f.k#FT.......j..r......n	J.....5..h|.C.n
02:06:20.364807 IP comp3134-Winter2024.ssh > 141.117.117.234.13056: Flags [P.], seq 1912:2012, ack 1, win 501, options [nop,nop,TS val 2951440797 ecr 1725459235], length 100
E...\.@.@.(...!..uu...3.pl.H...~...........
..i.f.k#.4.....c\.@...R.Rdn......N.D.j........e.LQ....{...Vb!..d]wH....
....&C....pR
g..M.8/ 8.......<.h.D2.
02:06:20.364928 IP comp3134-Winter2024.ssh > 141.117.117.234.13056: Flags [P.], seq 2012:2252, ack 1, win 501, options [nop,nop,TS val 2951440797 ecr 1725459235], length 240
E..$\.@.@.(	..!..uu...3.pl.....~.....'.....
..i.f.k#...2......k/.p.....&C.*..)O.l%..K..r..P..-R!M.....Q....S..Uq...r.H..E.......>........;Z*aWu.........{
..........6.......0...^e.......A..w'..Q..jN.o|z.......E$`..O.Q!.Z.)...2.e...X..S....Tq4..T.....P..,..i...\.....\........?r......^<.2$.."..
02:06:20.364986 IP comp3134-Winter2024.ssh > 141.117.117.234.13056: Flags [P.], seq 2252:2288, ack 1, win 501, options [nop,nop,TS val 2951440797 ecr 1725459235], length 36
E..X\.@.@.(...!..uu...3.pl.....~.....[.....
..i.f.k#.....R.......L.l$..0...........V...i
02:06:20.370245 IP 141.117.117.234.13056 > comp3134-Winter2024.ssh: Flags [.], ack 2252, win 2018, options [nop,nop,TS val 1725459342 ecr 2951440797], length 0
EH.4..@.7..k.uu...!.3......~pl......ea.....
f.k...i.
02:06:20.370326 IP comp3134-Winter2024.ssh > 141.117.117.234.13056: Flags [P.], seq 2288:4752, ack 1, win 501, options [nop,nop,TS val 2951440803 ecr 1725459342], length 2464
E.	.\.@.@..W..!..uu...3.pl.....~...........
..i.f.k.>~.r....>...$f.3.<..Y}Vw).J.TY...WC...cx.G$..'x.Y.{.pu].A9.q....|.....xI"UR.....!.46".....cp...q.DIt..<D...Me.D.......Y+.8..S._....>.<....b.J	<{p+O.D..k...}..[......G..p1..C.......bIX[c.Q<....E@..k{...Z..3.7`....#....@..X4...........'...u....:..]gI.....Dh9...%....v=t...z.Ly....J19;.w*p...{.n...c.'..6.PJ........N!1.U....h.....F.T..T.q.z......>..R.0....f.......@,p.n.....t...Q~.)
..l.[....5t.:.R...G....h.;x.A..p..E..i'..cG.......R.E.k%..o.U........}.H.m..A5... .v...L(.l....xI..A..'...#..).nY.H*/XK`.^Av^^.a..&......vT.P.X.....Xe.v.F0Go}.Y&.KW-JL.f:..v[.T..;>.bS+..4..^N11j.r...r.>...R......../....M.y...:..:CU."0..x}W.m...{jb.4...s8.7....}:...#...............^^kb......7.....u.e.....6...@...Yh...FF(..9...lH...w..u..	..Q...qj.'5...21...6h.iP.7{....'.......# i;.kL......A8..G.6[._...%4o.2V...UoL.....z*.wip.*..<.._...T.\...u....9...'.0.......M97...$..+....w..V..&s/...64..4....[w..Y4.j.....'S?.... ..1........"...q....c._.F......}.h.myi0!	v........."..6..YGE)...%.^.$.n.<...#q.Yb..d....T...mO..S...................+|w..X..F.{a./..YF.;C:....G......X...l"....W~=vG...Q.YC...vA	.{%0s...t.........Ye..|.<....]Q..U.M..Y.........P..XS.'.n.r......z.R.	........Lf......F[jd..c.$.6...6..d..k.EU..=..aVy..1..Y....Cw....G.$7....O..*,.8..V.........w...N..7.k. .W....g A.3..Y./.`\.p.w1<6.K
......	X.O....C..T...#.....d./G`.....Z ..CyV.....\.5.......l.....\.Q.B..w...r.I\..*..-.s.6...(.......25)2.	yF@.S.........#&.	...t-.'d^......"......o.....Ej...ft.....Z..v.%..w.`.q>...{@_...	,I.g>	...z.....X"N.Rv6.lx..h.9.B..P.....\Z....!.m	.R..N.....7i........-...0..........-KD.....].@>...UNG^..s{.G..... W..\B	....tr 66..0@..!i.-J=.P<dl...7.c>..t...x...y.........>_.$......v..H..k.....U.eg..H....X&...Y'"...[3.....1.?p.-.y.^.