root@comp3134-Winter2024:~# tcpdump -i eth0 src 143.198.33.235
tcpdump: verbose output suppressed, use -v[v]... for full protocol decode
listening on eth0, link-type EN10MB (Ethernet), snapshot length 262144 bytes
02:15:23.658559 IP comp3134-Winter2024.ssh > 141.117.117.234.13056: Flags [P.], seq 1909331956:1909332008, ack 3369878382, win 501, options [nop,nop,TS val 2951984091 ecr 1726002619], length 52
02:15:23.661108 IP comp3134-Winter2024.ssh > 141.117.117.234.13056: Flags [P.], seq 52:160, ack 1, win 501, options [nop,nop,TS val 2951984093 ecr 1726002619], length 108
02:15:23.661208 IP comp3134-Winter2024.ssh > 141.117.117.234.13056: Flags [P.], seq 160:196, ack 1, win 501, options [nop,nop,TS val 2951984093 ecr 1726002619], length 36
02:15:23.661307 IP comp3134-Winter2024.ssh > 141.117.117.234.13056: Flags [P.], seq 196:248, ack 1, win 501, options [nop,nop,TS val 2951984094 ecr 1726002619], length 52
02:15:23.661365 IP comp3134-Winter2024.ssh > 141.117.117.234.13056: Flags [P.], seq 248:316, ack 1, win 501, options [nop,nop,TS val 2951984094 ecr 1726002619], length 68
02:15:23.661438 IP comp3134-Winter2024.ssh > 141.117.117.234.13056: Flags [P.], seq 316:420, ack 1, win 501, options [nop,nop,TS val 2951984094 ecr 1726002619], length 104
02:15:23.757964 IP comp3134-Winter2024.43270 > 67.207.67.3.domain: 59924+ [1au] PTR? 234.117.117.141.in-addr.arpa. (57)
02:15:23.758091 IP comp3134-Winter2024.54189 > 67.207.67.3.domain: 64133+ [1au] PTR? 234.117.117.141.in-addr.arpa. (57)
02:15:23.758132 IP comp3134-Winter2024.53106 > 67.207.67.2.domain: Flags [S], seq 685196403, win 64240, options [mss 1460,sackOK,TS val 3773247411 ecr 0,nop,wscale 7,tfo  cookiereq,nop,nop], length 0
02:15:23.759873 IP comp3134-Winter2024.53106 > 67.207.67.2.domain: Flags [.], ack 2255024825, win 502, options [nop,nop,TS val 3773247413 ecr 104976325], length 0
02:15:23.759947 IP comp3134-Winter2024.53106 > 67.207.67.2.domain: Flags [P.], seq 0:48, ack 1, win 502, options [nop,nop,TS val 3773247413 ecr 104976325], length 48 26670+ PTR? 234.117.117.141.in-addr.arpa. (46)
02:15:23.760819 IP comp3134-Winter2024.43270 > 67.207.67.3.domain: 59924+ PTR? 234.117.117.141.in-addr.arpa. (46)
02:15:23.761300 IP comp3134-Winter2024.53106 > 67.207.67.2.domain: Flags [.], ack 116, win 502, options [nop,nop,TS val 3773247415 ecr 104976327], length 0
02:15:23.774716 IP comp3134-Winter2024.54189 > 67.207.67.3.domain: 64133+ PTR? 234.117.117.141.in-addr.arpa. (46)
02:15:23.776076 IP comp3134-Winter2024.35190 > 67.207.67.3.domain: 60472+ [1au] PTR? 235.33.198.143.in-addr.arpa. (56)
02:15:23.776524 IP comp3134-Winter2024.35190 > 67.207.67.3.domain: 60472+ PTR? 235.33.198.143.in-addr.arpa. (45)
02:15:23.777248 IP comp3134-Winter2024.ssh > 141.117.117.234.13056: Flags [P.], seq 420:648, ack 1, win 501, options [nop,nop,TS val 2951984209 ecr 1726002633], length 228
02:15:23.777368 IP comp3134-Winter2024.ssh > 141.117.117.234.13056: Flags [P.], seq 648:888, ack 1, win 501, options [nop,nop,TS val 2951984210 ecr 1726002633], length 240
02:15:23.777430 IP comp3134-Winter2024.ssh > 141.117.117.234.13056: Flags [P.], seq 888:924, ack 1, win 501, options [nop,nop,TS val 2951984210 ecr 1726002633], length 36
02:15:23.777459 IP comp3134-Winter2024.ssh > 141.117.117.234.13056: Flags [P.], seq 924:1128, ack 1, win 501, options [nop,nop,TS val 2951984210 ecr 1726002633], length 204
02:15:23.777492 IP comp3134-Winter2024.ssh > 141.117.117.234.13056: Flags [P.], seq 1128:1164, ack 1, win 501, options [nop,nop,TS val 2951984210 ecr 1726002633], length 36
02:15:23.777541 IP comp3134-Winter2024.ssh > 141.117.117.234.13056: Flags [P.], seq 1164:1368, ack 1, win 501, options [nop,nop,TS val 2951984210 ecr 1726002633], length 204
02:15:23.777599 IP comp3134-Winter2024.ssh > 141.117.117.234.13056: Flags [P.], seq 1368:1404, ack 1, win 501, options [nop,nop,TS val 2951984210 ecr 1726002633], length 36
02:15:23.777633 IP comp3134-Winter2024.ssh > 141.117.117.234.13056: Flags [P.], seq 1404:1608, ack 1, win 501, options [nop,nop,TS val 2951984210 ecr 1726002633], length 204
02:15:23.777667 IP comp3134-Winter2024.ssh > 141.117.117.234.13056: Flags [P.], seq 1608:1644, ack 1, win 501, options [nop,nop,TS val 2951984210 ecr 1726002633], length 36
02:15:23.777733 IP comp3134-Winter2024.ssh > 141.117.117.234.13056: Flags [P.], seq 1644:1856, ack 1, win 501, options [nop,nop,TS val 2951984210 ecr 1726002633], length 212
02:15:23.777768 IP comp3134-Winter2024.ssh > 141.117.117.234.13056: Flags [P.], seq 1856:1892, ack 1, win 501, options [nop,nop,TS val 2951984210 ecr 1726002633], length 36
02:15:23.861942 IP comp3134-Winter2024.40712 > 67.207.67.3.domain: 41169+ [1au] PTR? 3.67.207.67.in-addr.arpa. (53)
02:15:23.862104 IP comp3134-Winter2024.43606 > 67.207.67.3.domain: 35954+ [1au] PTR? 3.67.207.67.in-addr.arpa. (53)
02:15:23.862154 IP comp3134-Winter2024.53106 > 67.207.67.2.domain: Flags [P.], seq 48:92, ack 116, win 502, options [nop,nop,TS val 3773247515 ecr 104976327], length 44 6571+ PTR? 3.67.207.67.in-addr.arpa. (42)
02:15:23.862643 IP comp3134-Winter2024.40712 > 67.207.67.3.domain: 41169+ PTR? 3.67.207.67.in-addr.arpa. (42)
02:15:23.862692 IP comp3134-Winter2024.53106 > 67.207.67.2.domain: Flags [.], ack 227, win 502, options [nop,nop,TS val 3773247516 ecr 104976428], length 0
02:15:23.862758 IP comp3134-Winter2024.43606 > 67.207.67.3.domain: 35954+ PTR? 3.67.207.67.in-addr.arpa. (42)
02:15:23.863680 IP comp3134-Winter2024.ssh > 141.117.117.234.13056: Flags [P.], seq 1892:2048, ack 1, win 501, options [nop,nop,TS val 2951984296 ecr 1726002750], length 156
02:15:23.863756 IP comp3134-Winter2024.ssh > 141.117.117.234.13056: Flags [P.], seq 2048:2084, ack 1, win 501, options [nop,nop,TS val 2951984296 ecr 1726002750], length 36
02:15:23.863848 IP comp3134-Winter2024.ssh > 141.117.117.234.13056: Flags [P.], seq 2084:2240, ack 1, win 501, options [nop,nop,TS val 2951984296 ecr 1726002750], length 156
02:15:23.863883 IP comp3134-Winter2024.ssh > 141.117.117.234.13056: Flags [P.], seq 2240:2276, ack 1, win 501, options [nop,nop,TS val 2951984296 ecr 1726002750], length 36
02:15:23.864242 IP comp3134-Winter2024.56805 > 67.207.67.3.domain: 5956+ [1au] PTR? 2.67.207.67.in-addr.arpa. (53)
02:15:23.864345 IP comp3134-Winter2024.55926 > 67.207.67.3.domain: 50449+ [1au] PTR? 2.67.207.67.in-addr.arpa. (53)
02:15:23.864376 IP comp3134-Winter2024.53106 > 67.207.67.2.domain: Flags [P.], seq 92:136, ack 227, win 502, options [nop,nop,TS val 3773247518 ecr 104976428], length 44 9635+ PTR? 2.67.207.67.in-addr.arpa. (42)
02:15:23.864896 IP comp3134-Winter2024.56805 > 67.207.67.3.domain: 5956+ PTR? 2.67.207.67.in-addr.arpa. (42)
02:15:23.864977 IP comp3134-Winter2024.55926 > 67.207.67.3.domain: 50449+ PTR? 2.67.207.67.in-addr.arpa. (42)
02:15:23.865663 IP comp3134-Winter2024.ssh > 141.117.117.234.13056: Flags [P.], seq 2276:2512, ack 1, win 501, options [nop,nop,TS val 2951984298 ecr 1726002750], length 236
02:15:23.865747 IP comp3134-Winter2024.ssh > 141.117.117.234.13056: Flags [P.], seq 2512:2548, ack 1, win 501, options [nop,nop,TS val 2951984298 ecr 1726002750], length 36
02:15:23.865878 IP comp3134-Winter2024.ssh > 141.117.117.234.13056: Flags [P.], seq 2548:2744, ack 1, win 501, options [nop,nop,TS val 2951984298 ecr 1726002750], length 196
02:15:23.865922 IP comp3134-Winter2024.ssh > 141.117.117.234.13056: Flags [P.], seq 2744:2780, ack 1, win 501, options [nop,nop,TS val 2951984298 ecr 1726002750], length 36
02:15:23.865995 IP comp3134-Winter2024.ssh > 141.117.117.234.13056: Flags [P.], seq 2780:3032, ack 1, win 501, options [nop,nop,TS val 2951984298 ecr 1726002750], length 252
02:15:23.866037 IP comp3134-Winter2024.ssh > 141.117.117.234.13056: Flags [P.], seq 3032:3068, ack 1, win 501, options [nop,nop,TS val 2951984298 ecr 1726002750], length 36
02:15:23.866096 IP comp3134-Winter2024.ssh > 141.117.117.234.13056: Flags [P.], seq 3068:3216, ack 1, win 501, options [nop,nop,TS val 2951984298 ecr 1726002750], length 148
02:15:23.866136 IP comp3134-Winter2024.ssh > 141.117.117.234.13056: Flags [P.], seq 3216:3252, ack 1, win 501, options [nop,nop,TS val 2951984298 ecr 1726002750], length 36
02:15:23.866201 IP comp3134-Winter2024.ssh > 141.117.117.234.13056: Flags [P.], seq 3252:3448, ack 1, win 501, options [nop,nop,TS val 2951984298 ecr 1726002750], length 196
02:15:23.866239 IP comp3134-Winter2024.ssh > 141.117.117.234.13056: Flags [P.], seq 3448:3484, ack 1, win 501, options [nop,nop,TS val 2951984299 ecr 1726002750], length 36
02:15:23.866297 IP comp3134-Winter2024.ssh > 141.117.117.234.13056: Flags [P.], seq 3484:3632, ack 1, win 501, options [nop,nop,TS val 2951984299 ecr 1726002750], length 148
02:15:23.866336 IP comp3134-Winter2024.ssh > 141.117.117.234.13056: Flags [P.], seq 3632:3668, ack 1, win 501, options [nop,nop,TS val 2951984299 ecr 1726002750], length 36
02:15:23.866396 IP comp3134-Winter2024.ssh > 141.117.117.234.13056: Flags [P.], seq 3668:3824, ack 1, win 501, options [nop,nop,TS val 2951984299 ecr 1726002750], length 156
02:15:23.866435 IP comp3134-Winter2024.ssh > 141.117.117.234.13056: Flags [P.], seq 3824:3860, ack 1, win 501, options [nop,nop,TS val 2951984299 ecr 1726002750], length 36
02:15:23.866492 IP comp3134-Winter2024.ssh > 141.117.117.234.13056: Flags [P.], seq 3860:4008, ack 1, win 501, options [nop,nop,TS val 2951984299 ecr 1726002750], length 148
02:15:23.866534 IP comp3134-Winter2024.ssh > 141.117.117.234.13056: Flags [P.], seq 4008:4044, ack 1, win 501, options [nop,nop,TS val 2951984299 ecr 1726002750], length 36
02:15:23.866591 IP comp3134-Winter2024.ssh > 141.117.117.234.13056: Flags [P.], seq 4044:4256, ack 1, win 501, options [nop,nop,TS val 2951984299 ecr 1726002750], length 212
02:15:23.866630 IP comp3134-Winter2024.ssh > 141.117.117.234.13056: Flags [P.], seq 4256:4292, ack 1, win 501, options [nop,nop,TS val 2951984299 ecr 1726002750], length 36
02:15:23.866685 IP comp3134-Winter2024.ssh > 141.117.117.234.13056: Flags [P.], seq 4292:4504, ack 1, win 501, options [nop,nop,TS val 2951984299 ecr 1726002750], length 212
02:15:23.866742 IP comp3134-Winter2024.ssh > 141.117.117.234.13056: Flags [P.], seq 4504:4540, ack 1, win 501, options [nop,nop,TS val 2951984299 ecr 1726002750], length 36
02:15:23.866809 IP comp3134-Winter2024.ssh > 141.117.117.234.13056: Flags [P.], seq 4540:4744, ack 1, win 501, options [nop,nop,TS val 2951984299 ecr 1726002750], length 204
02:15:23.866849 IP comp3134-Winter2024.ssh > 141.117.117.234.13056: Flags [P.], seq 4744:4780, ack 1, win 501, options [nop,nop,TS val 2951984299 ecr 1726002750], length 36
02:15:23.870166 IP comp3134-Winter2024.ssh > 141.117.117.234.13056: Flags [P.], seq 4780:6764, ack 1, win 501, options [nop,nop,TS val 2951984302 ecr 1726002836], length 1984
02:15:23.905303 IP comp3134-Winter2024.53106 > 67.207.67.2.domain: Flags [.], ack 338, win 502, options [nop,nop,TS val 3773247559 ecr 104976430], length 0
02:15:23.936614 IP comp3134-Winter2024 > 8.25.82.131: ICMP echo reply, id 4, seq 1, length 64
02:15:23.965537 IP comp3134-Winter2024.ssh > 141.117.117.234.13056: Flags [P.], seq 6764:6920, ack 1, win 501, options [nop,nop,TS val 2951984398 ecr 1726002842], length 156
02:15:23.965623 IP comp3134-Winter2024.ssh > 141.117.117.234.13056: Flags [P.], seq 6920:6956, ack 1, win 501, options [nop,nop,TS val 2951984398 ecr 1726002842], length 36
02:15:23.965743 IP comp3134-Winter2024.ssh > 141.117.117.234.13056: Flags [P.], seq 6956:7112, ack 1, win 501, options [nop,nop,TS val 2951984398 ecr 1726002842], length 156
02:15:23.965793 IP comp3134-Winter2024.ssh > 141.117.117.234.13056: Flags [P.], seq 7112:7148, ack 1, win 501, options [nop,nop,TS val 2951984398 ecr 1726002842], length 36
02:15:23.965869 IP comp3134-Winter2024.ssh > 141.117.117.234.13056: Flags [P.], seq 7148:7392, ack 1, win 501, options [nop,nop,TS val 2951984398 ecr 1726002842], length 244
02:15:23.965909 IP comp3134-Winter2024.ssh > 141.117.117.234.13056: Flags [P.], seq 7392:7428, ack 1, win 501, options [nop,nop,TS val 2951984398 ecr 1726002842], length 36
02:15:23.965960 IP comp3134-Winter2024.ssh > 141.117.117.234.13056: Flags [P.], seq 7428:7576, ack 1, win 501, options [nop,nop,TS val 2951984398 ecr 1726002842], length 148
02:15:23.965996 IP comp3134-Winter2024.ssh > 141.117.117.234.13056: Flags [P.], seq 7576:7612, ack 1, win 501, options [nop,nop,TS val 2951984398 ecr 1726002842], length 36
02:15:23.966050 IP comp3134-Winter2024.ssh > 141.117.117.234.13056: Flags [P.], seq 7612:7808, ack 1, win 501, options [nop,nop,TS val 2951984398 ecr 1726002842], length 196
02:15:23.966083 IP comp3134-Winter2024.ssh > 141.117.117.234.13056: Flags [P.], seq 7808:7844, ack 1, win 501, options [nop,nop,TS val 2951984398 ecr 1726002842], length 36
02:15:23.966135 IP comp3134-Winter2024.ssh > 141.117.117.234.13056: Flags [P.], seq 7844:7992, ack 1, win 501, options [nop,nop,TS val 2951984398 ecr 1726002842], length 148
02:15:23.966168 IP comp3134-Winter2024.ssh > 141.117.117.234.13056: Flags [P.], seq 7992:8028, ack 1, win 501, options [nop,nop,TS val 2951984398 ecr 1726002842], length 36
02:15:23.966219 IP comp3134-Winter2024.ssh > 141.117.117.234.13056: Flags [P.], seq 8028:8240, ack 1, win 501, options [nop,nop,TS val 2951984398 ecr 1726002842], length 212
02:15:23.966289 IP comp3134-Winter2024.ssh > 141.117.117.234.13056: Flags [P.], seq 8240:8488, ack 1, win 501, options [nop,nop,TS val 2951984399 ecr 1726002842], length 248
02:15:23.966366 IP comp3134-Winter2024.ssh > 141.117.117.234.13056: Flags [P.], seq 8488:8736, ack 1, win 501, options [nop,nop,TS val 2951984399 ecr 1726002842], length 248
02:15:23.966397 IP comp3134-Winter2024.ssh > 141.117.117.234.13056: Flags [P.], seq 8736:8772, ack 1, win 501, options [nop,nop,TS val 2951984399 ecr 1726002842], length 36
02:15:23.966449 IP comp3134-Winter2024.ssh > 141.117.117.234.13056: Flags [P.], seq 8772:8984, ack 1, win 501, options [nop,nop,TS val 2951984399 ecr 1726002842], length 212
02:15:23.966498 IP comp3134-Winter2024.ssh > 141.117.117.234.13056: Flags [P.], seq 8984:9020, ack 1, win 501, options [nop,nop,TS val 2951984399 ecr 1726002842], length 36
02:15:23.966562 IP comp3134-Winter2024.ssh > 141.117.117.234.13056: Flags [P.], seq 9020:9168, ack 1, win 501, options [nop,nop,TS val 2951984399 ecr 1726002842], length 148
02:15:23.966596 IP comp3134-Winter2024.ssh > 141.117.117.234.13056: Flags [P.], seq 9168:9204, ack 1, win 501, options [nop,nop,TS val 2951984399 ecr 1726002842], length 36
02:15:23.966646 IP comp3134-Winter2024.ssh > 141.117.117.234.13056: Flags [P.], seq 9204:9360, ack 1, win 501, options [nop,nop,TS val 2951984399 ecr 1726002842], length 156
02:15:23.966678 IP comp3134-Winter2024.ssh > 141.117.117.234.13056: Flags [P.], seq 9360:9396, ack 1, win 501, options [nop,nop,TS val 2951984399 ecr 1726002842], length 36
02:15:23.966730 IP comp3134-Winter2024.ssh > 141.117.117.234.13056: Flags [P.], seq 9396:9648, ack 1, win 501, options [nop,nop,TS val 2951984399 ecr 1726002842], length 252
02:15:23.966763 IP comp3134-Winter2024.ssh > 141.117.117.234.13056: Flags [P.], seq 9648:9684, ack 1, win 501, options [nop,nop,TS val 2951984399 ecr 1726002842], length 36
02:15:23.966811 IP comp3134-Winter2024.ssh > 141.117.117.234.13056: Flags [P.], seq 9684:9832, ack 1, win 501, options [nop,nop,TS val 2951984399 ecr 1726002842], length 148
02:15:23.966843 IP comp3134-Winter2024.ssh > 141.117.117.234.13056: Flags [P.], seq 9832:9868, ack 1, win 501, options [nop,nop,TS val 2951984399 ecr 1726002842], length 36
02:15:23.966891 IP comp3134-Winter2024.ssh > 141.117.117.234.13056: Flags [P.], seq 9868:10016, ack 1, win 501, options [nop,nop,TS val 2951984399 ecr 1726002842], length 148
02:15:23.966923 IP comp3134-Winter2024.ssh > 141.117.117.234.13056: Flags [P.], seq 10016:10052, ack 1, win 501, options [nop,nop,TS val 2951984399 ecr 1726002842], length 36
02:15:23.966970 IP comp3134-Winter2024.ssh > 141.117.117.234.13056: Flags [P.], seq 10052:10264, ack 1, win 501, options [nop,nop,TS val 2951984399 ecr 1726002842], length 212
02:15:23.967147 IP comp3134-Winter2024.ssh > 141.117.117.234.13056: Flags [P.], seq 10264:10300, ack 1, win 501, options [nop,nop,TS val 2951984399 ecr 1726002842], length 36
02:15:23.967212 IP comp3134-Winter2024.ssh > 141.117.117.234.13056: Flags [P.], seq 10300:10512, ack 1, win 501, options [nop,nop,TS val 2951984399 ecr 1726002842], length 212
02:15:23.967245 IP comp3134-Winter2024.ssh > 141.117.117.234.13056: Flags [P.], seq 10512:10548, ack 1, win 501, options [nop,nop,TS val 2951984400 ecr 1726002842], length 36
02:15:23.967292 IP comp3134-Winter2024.ssh > 141.117.117.234.13056: Flags [P.], seq 10548:10760, ack 1, win 501, options [nop,nop,TS val 2951984400 ecr 1726002842], length 212
02:15:23.967352 IP comp3134-Winter2024.ssh > 141.117.117.234.13056: Flags [P.], seq 10760:10796, ack 1, win 501, options [nop,nop,TS val 2951984400 ecr 1726002842], length 36
02:15:23.967376 IP comp3134-Winter2024.ssh > 141.117.117.234.13056: Flags [P.], seq 10796:11008, ack 1, win 501, options [nop,nop,TS val 2951984400 ecr 1726002842], length 212
02:15:23.967406 IP comp3134-Winter2024.ssh > 141.117.117.234.13056: Flags [P.], seq 11008:11044, ack 1, win 501, options [nop,nop,TS val 2951984400 ecr 1726002842], length 36
02:15:23.967452 IP comp3134-Winter2024.ssh > 141.117.117.234.13056: Flags [P.], seq 11044:11256, ack 1, win 501, options [nop,nop,TS val 2951984400 ecr 1726002842], length 212
02:15:23.967552 IP comp3134-Winter2024.ssh > 141.117.117.234.13056: Flags [P.], seq 11256:11504, ack 1, win 501, options [nop,nop,TS val 2951984400 ecr 1726002842], length 248
02:15:23.967617 IP comp3134-Winter2024.ssh > 141.117.117.234.13056: Flags [P.], seq 11504:11540, ack 1, win 501, options [nop,nop,TS val 2951984400 ecr 1726002842], length 36
02:15:23.967673 IP comp3134-Winter2024.ssh > 141.117.117.234.13056: Flags [P.], seq 11540:11752, ack 1, win 501, options [nop,nop,TS val 2951984400 ecr 1726002842], length 212
02:15:23.967727 IP comp3134-Winter2024.ssh > 141.117.117.234.13056: Flags [P.], seq 11752:11788, ack 1, win 501, options [nop,nop,TS val 2951984400 ecr 1726002842], length 36
02:15:23.967798 IP comp3134-Winter2024.ssh > 141.117.117.234.13056: Flags [P.], seq 11788:12000, ack 1, win 501, options [nop,nop,TS val 2951984400 ecr 1726002842], length 212
02:15:23.967846 IP comp3134-Winter2024.ssh > 141.117.117.234.13056: Flags [P.], seq 12000:12036, ack 1, win 501, options [nop,nop,TS val 2951984400 ecr 1726002842], length 36
02:15:23.967913 IP comp3134-Winter2024.ssh > 141.117.117.234.13056: Flags [P.], seq 12036:12248, ack 1, win 501, options [nop,nop,TS val 2951984400 ecr 1726002842], length 212
02:15:23.967959 IP comp3134-Winter2024.ssh > 141.117.117.234.13056: Flags [P.], seq 12248:12284, ack 1, win 501, options [nop,nop,TS val 2951984400 ecr 1726002842], length 36
02:15:23.968042 IP comp3134-Winter2024.ssh > 141.117.117.234.13056: Flags [P.], seq 12284:12496, ack 1, win 501, options [nop,nop,TS val 2951984400 ecr 1726002842], length 212
02:15:23.968085 IP comp3134-Winter2024.ssh > 141.117.117.234.13056: Flags [P.], seq 12496:12532, ack 1, win 501, options [nop,nop,TS val 2951984400 ecr 1726002842], length 36
02:15:23.968138 IP comp3134-Winter2024.ssh > 141.117.117.234.13056: Flags [P.], seq 12532:12744, ack 1, win 501, options [nop,nop,TS val 2951984400 ecr 1726002842], length 212
02:15:23.968172 IP comp3134-Winter2024.ssh > 141.117.117.234.13056: Flags [P.], seq 12744:12780, ack 1, win 501, options [nop,nop,TS val 2951984400 ecr 1726002842], length 36
02:15:23.968234 IP comp3134-Winter2024.ssh > 141.117.117.234.13056: Flags [P.], seq 12780:12992, ack 1, win 501, options [nop,nop,TS val 2951984401 ecr 1726002842], length 212
02:15:23.968302 IP comp3134-Winter2024.ssh > 141.117.117.234.13056: Flags [P.], seq 12992:13240, ack 1, win 501, options [nop,nop,TS val 2951984401 ecr 1726002842], length 248
02:15:23.968369 IP comp3134-Winter2024.ssh > 141.117.117.234.13056: Flags [P.], seq 13240:13488, ack 1, win 501, options [nop,nop,TS val 2951984401 ecr 1726002842], length 248
02:15:23.968415 IP comp3134-Winter2024.ssh > 141.117.117.234.13056: Flags [P.], seq 13488:13524, ack 1, win 501, options [nop,nop,TS val 2951984401 ecr 1726002842], length 36
02:15:23.968469 IP comp3134-Winter2024.ssh > 141.117.117.234.13056: Flags [P.], seq 13524:13736, ack 1, win 501, options [nop,nop,TS val 2951984401 ecr 1726002842], length 212
02:15:23.969620 IP comp3134-Winter2024.56570 > 67.207.67.3.domain: 10149+ [1au] PTR? 131.82.25.8.in-addr.arpa. (53)
02:15:23.969770 IP comp3134-Winter2024.47505 > 67.207.67.3.domain: 21202+ [1au] PTR? 131.82.25.8.in-addr.arpa. (53)
02:15:23.969823 IP comp3134-Winter2024.53106 > 67.207.67.2.domain: Flags [P.], seq 136:180, ack 338, win 502, options [nop,nop,TS val 3773247623 ecr 104976430], length 44 27532+ PTR? 131.82.25.8.in-addr.arpa. (42)
02:15:23.972343 IP comp3134-Winter2024.ssh > 141.117.117.234.13056: Flags [P.], seq 13736:15988, ack 1, win 501, options [nop,nop,TS val 2951984405 ecr 1726002939], length 2252
02:15:24.008711 IP comp3134-Winter2024.47505 > 67.207.67.3.domain: 21202+ PTR? 131.82.25.8.in-addr.arpa. (42)
02:15:24.008896 IP comp3134-Winter2024.56570 > 67.207.67.3.domain: 10149+ PTR? 131.82.25.8.in-addr.arpa. (42)
02:15:24.010959 IP comp3134-Winter2024.53106 > 67.207.67.2.domain: Flags [.], ack 436, win 502, options [nop,nop,TS val 3773247664 ecr 104976576], length 0
02:15:24.011586 IP comp3134-Winter2024.ssh > 141.117.117.234.13056: Flags [P.], seq 15988:16120, ack 1, win 501, options [nop,nop,TS val 2951984444 ecr 1726002944], length 132
02:15:24.011765 IP comp3134-Winter2024.ssh > 141.117.117.234.13056: Flags [P.], seq 16120:16156, ack 1, win 501, options [nop,nop,TS val 2951984444 ecr 1726002944], length 36
02:15:24.069527 IP comp3134-Winter2024.ssh > 141.117.117.234.13056: Flags [P.], seq 16156:16368, ack 1, win 501, options [nop,nop,TS val 2951984502 ecr 1726002984], length 212
02:15:24.069681 IP comp3134-Winter2024.ssh > 141.117.117.234.13056: Flags [P.], seq 16368:16616, ack 1, win 501, options [nop,nop,TS val 2951984502 ecr 1726002984], length 248
02:15:24.069773 IP comp3134-Winter2024.ssh > 141.117.117.234.13056: Flags [P.], seq 16616:16864, ack 1, win 501, options [nop,nop,TS val 2951984502 ecr 1726002984], length 248
02:15:24.069816 IP comp3134-Winter2024.ssh > 141.117.117.234.13056: Flags [P.], seq 16864:16900, ack 1, win 501, options [nop,nop,TS val 2951984502 ecr 1726002984], length 36
02:15:24.069870 IP comp3134-Winter2024.ssh > 141.117.117.234.13056: Flags [P.], seq 16900:17112, ack 1, win 501, options [nop,nop,TS val 2951984502 ecr 1726002984], length 212
02:15:24.069907 IP comp3134-Winter2024.ssh > 141.117.117.234.13056: Flags [P.], seq 17112:17148, ack 1, win 501, options [nop,nop,TS val 2951984502 ecr 1726002984], length 36
02:15:24.069964 IP comp3134-Winter2024.ssh > 141.117.117.234.13056: Flags [P.], seq 17148:17360, ack 1, win 501, options [nop,nop,TS val 2951984502 ecr 1726002984], length 212
02:15:24.070004 IP comp3134-Winter2024.ssh > 141.117.117.234.13056: Flags [P.], seq 17360:17396, ack 1, win 501, options [nop,nop,TS val 2951984502 ecr 1726002984], length 36
02:15:24.070064 IP comp3134-Winter2024.ssh > 141.117.117.234.13056: Flags [P.], seq 17396:17608, ack 1, win 501, options [nop,nop,TS val 2951984502 ecr 1726002984], length 212
02:15:24.070105 IP comp3134-Winter2024.ssh > 141.117.117.234.13056: Flags [P.], seq 17608:17644, ack 1, win 501, options [nop,nop,TS val 2951984502 ecr 1726002984], length 36
02:15:24.070159 IP comp3134-Winter2024.ssh > 141.117.117.234.13056: Flags [P.], seq 17644:17856, ack 1, win 501, options [nop,nop,TS val 2951984502 ecr 1726002984], length 212
02:15:24.070197 IP comp3134-Winter2024.ssh > 141.117.117.234.13056: Flags [P.], seq 17856:17892, ack 1, win 501, options [nop,nop,TS val 2951984502 ecr 1726002984], length 36
02:15:24.070250 IP comp3134-Winter2024.ssh > 141.117.117.234.13056: Flags [P.], seq 17892:18104, ack 1, win 501, options [nop,nop,TS val 2951984503 ecr 1726002984], length 212
02:15:24.070358 IP comp3134-Winter2024.ssh > 141.117.117.234.13056: Flags [P.], seq 18104:18388, ack 1, win 501, options [nop,nop,TS val 2951984503 ecr 1726002984], length 284
02:15:24.070408 IP comp3134-Winter2024.ssh > 141.117.117.234.13056: Flags [P.], seq 18388:18600, ack 1, win 501, options [nop,nop,TS val 2951984503 ecr 1726002984], length 212
02:15:24.070492 IP comp3134-Winter2024.ssh > 141.117.117.234.13056: Flags [P.], seq 18600:18848, ack 1, win 501, options [nop,nop,TS val 2951984503 ecr 1726002984], length 248
02:15:24.070530 IP comp3134-Winter2024.ssh > 141.117.117.234.13056: Flags [P.], seq 18848:18884, ack 1, win 501, options [nop,nop,TS val 2951984503 ecr 1726002984], length 36
02:15:24.070588 IP comp3134-Winter2024.ssh > 141.117.117.234.13056: Flags [P.], seq 18884:19096, ack 1, win 501, options [nop,nop,TS val 2951984503 ecr 1726002984], length 212
02:15:24.070627 IP comp3134-Winter2024.ssh > 141.117.117.234.13056: Flags [P.], seq 19096:19132, ack 1, win 501, options [nop,nop,TS val 2951984503 ecr 1726002984], length 36
02:15:24.070679 IP comp3134-Winter2024.ssh > 141.117.117.234.13056: Flags [P.], seq 19132:19344, ack 1, win 501, options [nop,nop,TS val 2951984503 ecr 1726002984], length 212
02:15:24.070718 IP comp3134-Winter2024.ssh > 141.117.117.234.13056: Flags [P.], seq 19344:19380, ack 1, win 501, options [nop,nop,TS val 2951984503 ecr 1726002984], length 36
02:15:24.070774 IP comp3134-Winter2024.ssh > 141.117.117.234.13056: Flags [P.], seq 19380:19592, ack 1, win 501, options [nop,nop,TS val 2951984503 ecr 1726002984], length 212
02:15:24.070816 IP comp3134-Winter2024.ssh > 141.117.117.234.13056: Flags [P.], seq 19592:19628, ack 1, win 501, options [nop,nop,TS val 2951984503 ecr 1726002984], length 36
02:15:24.070874 IP comp3134-Winter2024.ssh > 141.117.117.234.13056: Flags [P.], seq 19628:19840, ack 1, win 501, options [nop,nop,TS val 2951984503 ecr 1726002984], length 212
02:15:24.070917 IP comp3134-Winter2024.ssh > 141.117.117.234.13056: Flags [P.], seq 19840:19876, ack 1, win 501, options [nop,nop,TS val 2951984503 ecr 1726002984], length 36
02:15:24.070979 IP comp3134-Winter2024.ssh > 141.117.117.234.13056: Flags [P.], seq 19876:20088, ack 1, win 501, options [nop,nop,TS val 2951984503 ecr 1726002984], length 212
02:15:24.071181 IP comp3134-Winter2024.ssh > 141.117.117.234.13056: Flags [P.], seq 20088:20124, ack 1, win 501, options [nop,nop,TS val 2951984503 ecr 1726002984], length 36
02:15:24.071254 IP comp3134-Winter2024.ssh > 141.117.117.234.13056: Flags [P.], seq 20124:20336, ack 1, win 501, options [nop,nop,TS val 2951984504 ecr 1726002984], length 212
02:15:24.071318 IP comp3134-Winter2024.ssh > 141.117.117.234.13056: Flags [P.], seq 20336:20372, ack 1, win 501, options [nop,nop,TS val 2951984504 ecr 1726002984], length 36
02:15:24.071360 IP comp3134-Winter2024.ssh > 141.117.117.234.13056: Flags [P.], seq 20372:20584, ack 1, win 501, options [nop,nop,TS val 2951984504 ecr 1726002984], length 212
02:15:24.071400 IP comp3134-Winter2024.ssh > 141.117.117.234.13056: Flags [P.], seq 20584:20620, ack 1, win 501, options [nop,nop,TS val 2951984504 ecr 1726002984], length 36
02:15:24.071467 IP comp3134-Winter2024.ssh > 141.117.117.234.13056: Flags [P.], seq 20620:20832, ack 1, win 501, options [nop,nop,TS val 2951984504 ecr 1726002984], length 212
02:15:24.071520 IP comp3134-Winter2024.ssh > 141.117.117.234.13056: Flags [P.], seq 20832:20868, ack 1, win 501, options [nop,nop,TS val 2951984504 ecr 1726002984], length 36
02:15:24.071579 IP comp3134-Winter2024.ssh > 141.117.117.234.13056: Flags [P.], seq 20868:21080, ack 1, win 501, options [nop,nop,TS val 2951984504 ecr 1726002984], length 212
02:15:24.071618 IP comp3134-Winter2024.ssh > 141.117.117.234.13056: Flags [P.], seq 21080:21116, ack 1, win 501, options [nop,nop,TS val 2951984504 ecr 1726002984], length 36
02:15:24.071669 IP comp3134-Winter2024.ssh > 141.117.117.234.13056: Flags [P.], seq 21116:21328, ack 1, win 501, options [nop,nop,TS val 2951984504 ecr 1726002984], length 212
02:15:24.071708 IP comp3134-Winter2024.ssh > 141.117.117.234.13056: Flags [P.], seq 21328:21364, ack 1, win 501, options [nop,nop,TS val 2951984504 ecr 1726002984], length 36
02:15:24.071765 IP comp3134-Winter2024.ssh > 141.117.117.234.13056: Flags [P.], seq 21364:21576, ack 1, win 501, options [nop,nop,TS val 2951984504 ecr 1726002984], length 212
02:15:24.071807 IP comp3134-Winter2024.ssh > 141.117.117.234.13056: Flags [P.], seq 21576:21612, ack 1, win 501, options [nop,nop,TS val 2951984504 ecr 1726002984], length 36
02:15:24.071863 IP comp3134-Winter2024.ssh > 141.117.117.234.13056: Flags [P.], seq 21612:21824, ack 1, win 501, options [nop,nop,TS val 2951984504 ecr 1726002984], length 212
02:15:24.071903 IP comp3134-Winter2024.ssh > 141.117.117.234.13056: Flags [P.], seq 21824:21860, ack 1, win 501, options [nop,nop,TS val 2951984504 ecr 1726002984], length 36
02:15:24.071959 IP comp3134-Winter2024.ssh > 141.117.117.234.13056: Flags [P.], seq 21860:22072, ack 1, win 501, options [nop,nop,TS val 2951984504 ecr 1726002984], length 212
02:15:24.071997 IP comp3134-Winter2024.ssh > 141.117.117.234.13056: Flags [P.], seq 22072:22108, ack 1, win 501, options [nop,nop,TS val 2951984504 ecr 1726002984], length 36
02:15:24.072050 IP comp3134-Winter2024.ssh > 141.117.117.234.13056: Flags [P.], seq 22108:22320, ack 1, win 501, options [nop,nop,TS val 2951984504 ecr 1726002984], length 212
02:15:24.072115 IP comp3134-Winter2024.ssh > 141.117.117.234.13056: Flags [P.], seq 22320:22356, ack 1, win 501, options [nop,nop,TS val 2951984504 ecr 1726002984], length 36
02:15:24.072155 IP comp3134-Winter2024.ssh > 141.117.117.234.13056: Flags [P.], seq 22356:22568, ack 1, win 501, options [nop,nop,TS val 2951984504 ecr 1726002984], length 212
02:15:24.072195 IP comp3134-Winter2024.ssh > 141.117.117.234.13056: Flags [P.], seq 22568:22604, ack 1, win 501, options [nop,nop,TS val 2951984504 ecr 1726002984], length 36
02:15:24.072254 IP comp3134-Winter2024.ssh > 141.117.117.234.13056: Flags [P.], seq 22604:22816, ack 1, win 501, options [nop,nop,TS val 2951984505 ecr 1726002984], length 212
02:15:24.072294 IP comp3134-Winter2024.ssh > 141.117.117.234.13056: Flags [P.], seq 22816:22852, ack 1, win 501, options [nop,nop,TS val 2951984505 ecr 1726002984], length 36
02:15:24.072348 IP comp3134-Winter2024.ssh > 141.117.117.234.13056: Flags [P.], seq 22852:23064, ack 1, win 501, options [nop,nop,TS val 2951984505 ecr 1726002984], length 212
02:15:24.072386 IP comp3134-Winter2024.ssh > 141.117.117.234.13056: Flags [P.], seq 23064:23100, ack 1, win 501, options [nop,nop,TS val 2951984505 ecr 1726002984], length 36
02:15:24.072439 IP comp3134-Winter2024.ssh > 141.117.117.234.13056: Flags [P.], seq 23100:23312, ack 1, win 501, options [nop,nop,TS val 2951984505 ecr 1726002984], length 212
02:15:24.072478 IP comp3134-Winter2024.ssh > 141.117.117.234.13056: Flags [P.], seq 23312:23348, ack 1, win 501, options [nop,nop,TS val 2951984505 ecr 1726002984], length 36
02:15:24.072539 IP comp3134-Winter2024.ssh > 141.117.117.234.13056: Flags [P.], seq 23348:23560, ack 1, win 501, options [nop,nop,TS val 2951984505 ecr 1726002984], length 212
02:15:24.072579 IP comp3134-Winter2024.ssh > 141.117.117.234.13056: Flags [P.], seq 23560:23596, ack 1, win 501, options [nop,nop,TS val 2951984505 ecr 1726002984], length 36
02:15:24.072637 IP comp3134-Winter2024.ssh > 141.117.117.234.13056: Flags [P.], seq 23596:23808, ack 1, win 501, options [nop,nop,TS val 2951984505 ecr 1726002984], length 212
02:15:24.072676 IP comp3134-Winter2024.ssh > 141.117.117.234.13056: Flags [P.], seq 23808:23844, ack 1, win 501, options [nop,nop,TS val 2951984505 ecr 1726002984], length 36
02:15:24.072734 IP comp3134-Winter2024.ssh > 141.117.117.234.13056: Flags [P.], seq 23844:24056, ack 1, win 501, options [nop,nop,TS val 2951984505 ecr 1726002984], length 212
02:15:24.072772 IP comp3134-Winter2024.ssh > 141.117.117.234.13056: Flags [P.], seq 24056:24092, ack 1, win 501, options [nop,nop,TS val 2951984505 ecr 1726002984], length 36
02:15:24.072824 IP comp3134-Winter2024.ssh > 141.117.117.234.13056: Flags [P.], seq 24092:24304, ack 1, win 501, options [nop,nop,TS val 2951984505 ecr 1726002984], length 212
02:15:24.072861 IP comp3134-Winter2024.ssh > 141.117.117.234.13056: Flags [P.], seq 24304:24340, ack 1, win 501, options [nop,nop,TS val 2951984505 ecr 1726002984], length 36
02:15:24.072914 IP comp3134-Winter2024.ssh > 141.117.117.234.13056: Flags [P.], seq 24340:24552, ack 1, win 501, options [nop,nop,TS val 2951984505 ecr 1726002984], length 212
02:15:24.072956 IP comp3134-Winter2024.ssh > 141.117.117.234.13056: Flags [P.], seq 24552:24588, ack 1, win 501, options [nop,nop,TS val 2951984505 ecr 1726002984], length 36
02:15:24.073015 IP comp3134-Winter2024.ssh > 141.117.117.234.13056: Flags [P.], seq 24588:24800, ack 1, win 501, options [nop,nop,TS val 2951984505 ecr 1726002984], length 212
02:15:24.073054 IP comp3134-Winter2024.ssh > 141.117.117.234.13056: Flags [P.], seq 24800:24836, ack 1, win 501, options [nop,nop,TS val 2951984505 ecr 1726002984], length 36
02:15:24.073110 IP comp3134-Winter2024.ssh > 141.117.117.234.13056: Flags [P.], seq 24836:25048, ack 1, win 501, options [nop,nop,TS val 2951984505 ecr 1726002984], length 212
02:15:24.073148 IP comp3134-Winter2024.ssh > 141.117.117.234.13056: Flags [P.], seq 25048:25084, ack 1, win 501, options [nop,nop,TS val 2951984505 ecr 1726002984], length 36
02:15:24.073201 IP comp3134-Winter2024.ssh > 141.117.117.234.13056: Flags [P.], seq 25084:25296, ack 1, win 501, options [nop,nop,TS val 2951984505 ecr 1726002984], length 212
02:15:24.073259 IP comp3134-Winter2024.ssh > 141.117.117.234.13056: Flags [P.], seq 25296:25332, ack 1, win 501, options [nop,nop,TS val 2951984506 ecr 1726002984], length 36
02:15:24.073313 IP comp3134-Winter2024.ssh > 141.117.117.234.13056: Flags [P.], seq 25332:25544, ack 1, win 501, options [nop,nop,TS val 2951984506 ecr 1726002984], length 212
02:15:24.073355 IP comp3134-Winter2024.ssh > 141.117.117.234.13056: Flags [P.], seq 25544:25580, ack 1, win 501, options [nop,nop,TS val 2951984506 ecr 1726002984], length 36
02:15:24.073415 IP comp3134-Winter2024.ssh > 141.117.117.234.13056: Flags [P.], seq 25580:25792, ack 1, win 501, options [nop,nop,TS val 2951984506 ecr 1726002984], length 212
02:15:24.073459 IP comp3134-Winter2024.ssh > 141.117.117.234.13056: Flags [P.], seq 25792:25828, ack 1, win 501, options [nop,nop,TS val 2951984506 ecr 1726002984], length 36
02:15:24.073517 IP comp3134-Winter2024.ssh > 141.117.117.234.13056: Flags [P.], seq 25828:26040, ack 1, win 501, options [nop,nop,TS val 2951984506 ecr 1726002984], length 212
02:15:24.073596 IP comp3134-Winter2024.ssh > 141.117.117.234.13056: Flags [P.], seq 26040:26428, ack 1, win 501, options [nop,nop,TS val 2951984506 ecr 1726002984], length 388
02:15:24.073701 IP comp3134-Winter2024.ssh > 141.117.117.234.13056: Flags [P.], seq 26428:26992, ack 1, win 501, options [nop,nop,TS val 2951984506 ecr 1726002984], length 564
02:15:24.073822 IP comp3134-Winter2024.ssh > 141.117.117.234.13056: Flags [P.], seq 26992:27380, ack 1, win 501, options [nop,nop,TS val 2951984506 ecr 1726002984], length 388
02:15:24.073882 IP comp3134-Winter2024.ssh > 141.117.117.234.13056: Flags [P.], seq 27380:27768, ack 1, win 501, options [nop,nop,TS val 2951984506 ecr 1726002984], length 388
02:15:24.073923 IP comp3134-Winter2024.ssh > 141.117.117.234.13056: Flags [P.], seq 27768:27804, ack 1, win 501, options [nop,nop,TS val 2951984506 ecr 1726002984], length 36
02:15:24.073996 IP comp3134-Winter2024.ssh > 141.117.117.234.13056: Flags [P.], seq 27804:28192, ack 1, win 501, options [nop,nop,TS val 2951984506 ecr 1726002984], length 388
02:15:24.074070 IP comp3134-Winter2024.ssh > 141.117.117.234.13056: Flags [P.], seq 28192:28580, ack 1, win 501, options [nop,nop,TS val 2951984506 ecr 1726002984], length 388
02:15:24.074189 IP comp3134-Winter2024.ssh > 141.117.117.234.13056: Flags [P.], seq 28580:28912, ack 1, win 501, options [nop,nop,TS val 2951984506 ecr 1726002984], length 332
02:15:24.074265 IP comp3134-Winter2024.ssh > 141.117.117.234.13056: Flags [P.], seq 28912:29068, ack 1, win 501, options [nop,nop,TS val 2951984507 ecr 1726002984], length 156
02:15:24.074331 IP comp3134-Winter2024.ssh > 141.117.117.234.13056: Flags [P.], seq 29068:29320, ack 1, win 501, options [nop,nop,TS val 2951984507 ecr 1726002984], length 252
02:15:24.074414 IP comp3134-Winter2024.ssh > 141.117.117.234.13056: Flags [P.], seq 29320:29644, ack 1, win 501, options [nop,nop,TS val 2951984507 ecr 1726002984], length 324
02:15:24.074520 IP comp3134-Winter2024.ssh > 141.117.117.234.13056: Flags [P.], seq 29644:30128, ack 1, win 501, options [nop,nop,TS val 2951984507 ecr 1726002984], length 484
02:15:24.074594 IP comp3134-Winter2024.ssh > 141.117.117.234.13056: Flags [P.], seq 30128:30340, ack 1, win 501, options [nop,nop,TS val 2951984507 ecr 1726002984], length 212
02:15:24.117323 IP comp3134-Winter2024.ssh > 141.117.117.234.13056: Flags [.], ack 37, win 501, options [nop,nop,TS val 2951984550 ecr 1726003044], length 0
02:15:24.173519 IP comp3134-Winter2024.ssh > 141.117.117.234.13056: Flags [P.], seq 30340:30728, ack 37, win 501, options [nop,nop,TS val 2951984606 ecr 1726003044], length 388
02:15:24.173784 IP comp3134-Winter2024.ssh > 141.117.117.234.13056: Flags [P.], seq 30728:32356, ack 37, win 501, options [nop,nop,TS val 2951984606 ecr 1726003044], length 1628
02:15:24.173897 IP comp3134-Winter2024.ssh > 141.117.117.234.13056: Flags [P.], seq 32356:33104, ack 37, win 501, options [nop,nop,TS val 2951984606 ecr 1726003044], length 748
02:15:24.174000 IP comp3134-Winter2024.ssh > 141.117.117.234.13056: Flags [P.], seq 33104:33492, ack 37, win 501, options [nop,nop,TS val 2951984606 ecr 1726003044], length 388
02:15:24.174072 IP comp3134-Winter2024.ssh > 141.117.117.234.13056: Flags [P.], seq 33492:33880, ack 37, win 501, options [nop,nop,TS val 2951984606 ecr 1726003044], length 388
02:15:24.174155 IP comp3134-Winter2024.ssh > 141.117.117.234.13056: Flags [P.], seq 33880:34268, ack 37, win 501, options [nop,nop,TS val 2951984606 ecr 1726003044], length 388
02:15:24.174266 IP comp3134-Winter2024.ssh > 141.117.117.234.13056: Flags [P.], seq 34268:34832, ack 37, win 501, options [nop,nop,TS val 2951984607 ecr 1726003044], length 564
02:15:24.174384 IP comp3134-Winter2024.ssh > 141.117.117.234.13056: Flags [P.], seq 34832:35608, ack 37, win 501, options [nop,nop,TS val 2951984607 ecr 1726003044], length 776
02:15:24.174454 IP comp3134-Winter2024.ssh > 141.117.117.234.13056: Flags [P.], seq 35608:35996, ack 37, win 501, options [nop,nop,TS val 2951984607 ecr 1726003044], length 388
02:15:24.174523 IP comp3134-Winter2024.ssh > 141.117.117.234.13056: Flags [P.], seq 35996:36384, ack 37, win 501, options [nop,nop,TS val 2951984607 ecr 1726003044], length 388
02:15:24.174607 IP comp3134-Winter2024.ssh > 141.117.117.234.13056: Flags [P.], seq 36384:36948, ack 37, win 501, options [nop,nop,TS val 2951984607 ecr 1726003044], length 564
02:15:24.174666 IP comp3134-Winter2024.ssh > 141.117.117.234.13056: Flags [P.], seq 36948:37168, ack 37, win 501, options [nop,nop,TS val 2951984607 ecr 1726003044], length 220
02:15:24.174707 IP comp3134-Winter2024.ssh > 141.117.117.234.13056: Flags [P.], seq 37168:37380, ack 37, win 501, options [nop,nop,TS val 2951984607 ecr 1726003044], length 212
02:15:24.174760 IP comp3134-Winter2024.ssh > 141.117.117.234.13056: Flags [P.], seq 37380:37600, ack 37, win 501, options [nop,nop,TS val 2951984607 ecr 1726003044], length 220
02:15:24.174824 IP comp3134-Winter2024.ssh > 141.117.117.234.13056: Flags [P.], seq 37600:37988, ack 37, win 501, options [nop,nop,TS val 2951984607 ecr 1726003044], length 388
02:15:24.174944 IP comp3134-Winter2024.ssh > 141.117.117.234.13056: Flags [P.], seq 37988:38376, ack 37, win 501, options [nop,nop,TS val 2951984607 ecr 1726003044], length 388
02:15:24.175179 IP comp3134-Winter2024.ssh > 141.117.117.234.13056: Flags [P.], seq 38376:38588, ack 37, win 501, options [nop,nop,TS val 2951984607 ecr 1726003044], length 212
02:15:24.175231 IP comp3134-Winter2024.ssh > 141.117.117.234.13056: Flags [P.], seq 38588:38624, ack 37, win 501, options [nop,nop,TS val 2951984608 ecr 1726003044], length 36
02:15:24.175290 IP comp3134-Winter2024.ssh > 141.117.117.234.13056: Flags [P.], seq 38624:38836, ack 37, win 501, options [nop,nop,TS val 2951984608 ecr 1726003044], length 212
02:15:24.175323 IP comp3134-Winter2024.ssh > 141.117.117.234.13056: Flags [P.], seq 38836:38872, ack 37, win 501, options [nop,nop,TS val 2951984608 ecr 1726003044], length 36
02:15:24.175391 IP comp3134-Winter2024.ssh > 141.117.117.234.13056: Flags [P.], seq 38872:39084, ack 37, win 501, options [nop,nop,TS val 2951984608 ecr 1726003044], length 212
02:15:24.175477 IP comp3134-Winter2024.ssh > 141.117.117.234.13056: Flags [P.], seq 39084:39472, ack 37, win 501, options [nop,nop,TS val 2951984608 ecr 1726003044], length 388
02:15:24.175549 IP comp3134-Winter2024.ssh > 141.117.117.234.13056: Flags [P.], seq 39472:39860, ack 37, win 501, options [nop,nop,TS val 2951984608 ecr 1726003044], length 388
02:15:24.175635 IP comp3134-Winter2024.ssh > 141.117.117.234.13056: Flags [P.], seq 39860:40424, ack 37, win 501, options [nop,nop,TS val 2951984608 ecr 1726003044], length 564
02:15:24.175701 IP comp3134-Winter2024.ssh > 141.117.117.234.13056: Flags [P.], seq 40424:40636, ack 37, win 501, options [nop,nop,TS val 2951984608 ecr 1726003044], length 212
02:15:24.175791 IP comp3134-Winter2024.ssh > 141.117.117.234.13056: Flags [P.], seq 40636:41024, ack 37, win 501, options [nop,nop,TS val 2951984608 ecr 1726003044], length 388
02:15:24.175884 IP comp3134-Winter2024.ssh > 141.117.117.234.13056: Flags [P.], seq 41024:41588, ack 37, win 501, options [nop,nop,TS val 2951984608 ecr 1726003044], length 564
02:15:24.175962 IP comp3134-Winter2024.ssh > 141.117.117.234.13056: Flags [P.], seq 41588:41976, ack 37, win 501, options [nop,nop,TS val 2951984608 ecr 1726003044], length 388
02:15:24.176039 IP comp3134-Winter2024.ssh > 141.117.117.234.13056: Flags [P.], seq 41976:42364, ack 37, win 501, options [nop,nop,TS val 2951984608 ecr 1726003044], length 388
02:15:24.176121 IP comp3134-Winter2024.ssh > 141.117.117.234.13056: Flags [P.], seq 42364:42752, ack 37, win 501, options [nop,nop,TS val 2951984608 ecr 1726003044], length 388
02:15:24.176255 IP comp3134-Winter2024.ssh > 141.117.117.234.13056: Flags [P.], seq 42752:43140, ack 37, win 501, options [nop,nop,TS val 2951984609 ecr 1726003044], length 388
02:15:24.176372 IP comp3134-Winter2024.ssh > 141.117.117.234.13056: Flags [P.], seq 43140:43704, ack 37, win 501, options [nop,nop,TS val 2951984609 ecr 1726003044], length 564
02:15:24.176448 IP comp3134-Winter2024.ssh > 141.117.117.234.13056: Flags [P.], seq 43704:44100, ack 37, win 501, options [nop,nop,TS val 2951984609 ecr 1726003044], length 396
02:15:24.176524 IP comp3134-Winter2024.ssh > 141.117.117.234.13056: Flags [P.], seq 44100:44488, ack 37, win 501, options [nop,nop,TS val 2951984609 ecr 1726003044], length 388
02:15:24.176628 IP comp3134-Winter2024.ssh > 141.117.117.234.13056: Flags [P.], seq 44488:45060, ack 37, win 501, options [nop,nop,TS val 2951984609 ecr 1726003044], length 572
02:15:24.176711 IP comp3134-Winter2024.ssh > 141.117.117.234.13056: Flags [P.], seq 45060:45448, ack 37, win 501, options [nop,nop,TS val 2951984609 ecr 1726003044], length 388
02:15:24.176793 IP comp3134-Winter2024.ssh > 141.117.117.234.13056: Flags [P.], seq 45448:45836, ack 37, win 501, options [nop,nop,TS val 2951984609 ecr 1726003044], length 388
02:15:24.176880 IP comp3134-Winter2024.ssh > 141.117.117.234.13056: Flags [P.], seq 45836:46408, ack 37, win 501, options [nop,nop,TS val 2951984609 ecr 1726003044], length 572
02:15:24.176949 IP comp3134-Winter2024.ssh > 141.117.117.234.13056: Flags [P.], seq 46408:46796, ack 37, win 501, options [nop,nop,TS val 2951984609 ecr 1726003044], length 388
02:15:24.177016 IP comp3134-Winter2024.ssh > 141.117.117.234.13056: Flags [P.], seq 46796:47184, ack 37, win 501, options [nop,nop,TS val 2951984609 ecr 1726003044], length 388
02:15:24.177085 IP comp3134-Winter2024.ssh > 141.117.117.234.13056: Flags [P.], seq 47184:47380, ack 37, win 501, options [nop,nop,TS val 2951984609 ecr 1726003044], length 196
02:15:24.177136 IP comp3134-Winter2024.ssh > 141.117.117.234.13056: Flags [P.], seq 47380:47416, ack 37, win 501, options [nop,nop,TS val 2951984609 ecr 1726003044], length 36
02:15:24.277706 IP comp3134-Winter2024.ssh > 141.117.117.234.13056: Flags [P.], seq 47416:47628, ack 37, win 501, options [nop,nop,TS val 2951984710 ecr 1726003159], length 212
02:15:24.277921 IP comp3134-Winter2024.ssh > 141.117.117.234.13056: Flags [P.], seq 47628:48376, ack 37, win 501, options [nop,nop,TS val 2951984710 ecr 1726003159], length 748
02:15:24.278021 IP comp3134-Winter2024.ssh > 141.117.117.234.13056: Flags [P.], seq 48376:48948, ack 37, win 501, options [nop,nop,TS val 2951984710 ecr 1726003159], length 572
02:15:24.278115 IP comp3134-Winter2024.ssh > 141.117.117.234.13056: Flags [P.], seq 48948:49344, ack 37, win 501, options [nop,nop,TS val 2951984710 ecr 1726003159], length 396
02:15:24.278216 IP comp3134-Winter2024.ssh > 141.117.117.234.13056: Flags [P.], seq 49344:49740, ack 37, win 501, options [nop,nop,TS val 2951984710 ecr 1726003159], length 396
02:15:24.278324 IP comp3134-Winter2024.ssh > 141.117.117.234.13056: Flags [P.], seq 49740:50136, ack 37, win 501, options [nop,nop,TS val 2951984711 ecr 1726003159], length 396
02:15:24.278422 IP comp3134-Winter2024.ssh > 141.117.117.234.13056: Flags [P.], seq 50136:50532, ack 37, win 501, options [nop,nop,TS val 2951984711 ecr 1726003159], length 396
02:15:24.278624 IP comp3134-Winter2024.ssh > 141.117.117.234.13056: Flags [P.], seq 50532:51280, ack 37, win 501, options [nop,nop,TS val 2951984711 ecr 1726003159], length 748
02:15:24.278802 IP comp3134-Winter2024.ssh > 141.117.117.234.13056: Flags [P.], seq 51280:52028, ack 37, win 501, options [nop,nop,TS val 2951984711 ecr 1726003159], length 748
02:15:24.278868 IP comp3134-Winter2024.ssh > 141.117.117.234.13056: Flags [P.], seq 52028:52240, ack 37, win 501, options [nop,nop,TS val 2951984711 ecr 1726003159], length 212
02:15:24.279139 IP comp3134-Winter2024.ssh > 141.117.117.234.13056: Flags [P.], seq 52240:53164, ack 37, win 501, options [nop,nop,TS val 2951984711 ecr 1726003159], length 924
02:15:24.279188 IP comp3134-Winter2024.ssh > 141.117.117.234.13056: Flags [P.], seq 53164:53200, ack 37, win 501, options [nop,nop,TS val 2951984711 ecr 1726003159], length 36
02:15:24.279256 IP comp3134-Winter2024.ssh > 141.117.117.234.13056: Flags [P.], seq 53200:53412, ack 37, win 501, options [nop,nop,TS val 2951984712 ecr 1726003159], length 212
02:15:24.279346 IP comp3134-Winter2024.ssh > 141.117.117.234.13056: Flags [P.], seq 53412:53808, ack 37, win 501, options [nop,nop,TS val 2951984712 ecr 1726003159], length 396
02:15:24.279505 IP comp3134-Winter2024.ssh > 141.117.117.234.13056: Flags [P.], seq 53808:54592, ack 37, win 501, options [nop,nop,TS val 2951984712 ecr 1726003159], length 784
02:15:24.279603 IP comp3134-Winter2024.ssh > 141.117.117.234.13056: Flags [P.], seq 54592:54988, ack 37, win 501, options [nop,nop,TS val 2951984712 ecr 1726003159], length 396
02:15:24.279712 IP comp3134-Winter2024.ssh > 141.117.117.234.13056: Flags [P.], seq 54988:55560, ack 37, win 501, options [nop,nop,TS val 2951984712 ecr 1726003159], length 572
02:15:24.279770 IP comp3134-Winter2024.ssh > 141.117.117.234.13056: Flags [P.], seq 55560:55596, ack 37, win 501, options [nop,nop,TS val 2951984712 ecr 1726003159], length 36
02:15:24.381552 IP comp3134-Winter2024.ssh > 141.117.117.234.13056: Flags [P.], seq 55596:55808, ack 37, win 501, options [nop,nop,TS val 2951984814 ecr 1726003253], length 212
02:15:24.381747 IP comp3134-Winter2024.ssh > 141.117.117.234.13056: Flags [P.], seq 55808:56020, ack 37, win 501, options [nop,nop,TS val 2951984814 ecr 1726003253], length 212
02:15:24.381853 IP comp3134-Winter2024.ssh > 141.117.117.234.13056: Flags [P.], seq 56020:56416, ack 37, win 501, options [nop,nop,TS val 2951984814 ecr 1726003253], length 396
02:15:24.381967 IP comp3134-Winter2024.ssh > 141.117.117.234.13056: Flags [P.], seq 56416:56988, ack 37, win 501, options [nop,nop,TS val 2951984814 ecr 1726003253], length 572
02:15:24.382060 IP comp3134-Winter2024.ssh > 141.117.117.234.13056: Flags [P.], seq 56988:57384, ack 37, win 501, options [nop,nop,TS val 2951984814 ecr 1726003253], length 396
02:15:24.382169 IP comp3134-Winter2024.ssh > 141.117.117.234.13056: Flags [P.], seq 57384:57956, ack 37, win 501, options [nop,nop,TS val 2951984814 ecr 1726003253], length 572
02:15:24.382283 IP comp3134-Winter2024.ssh > 141.117.117.234.13056: Flags [P.], seq 57956:58528, ack 37, win 501, options [nop,nop,TS val 2951984815 ecr 1726003253], length 572
02:15:24.382393 IP comp3134-Winter2024.ssh > 141.117.117.234.13056: Flags [P.], seq 58528:59100, ack 37, win 501, options [nop,nop,TS val 2951984815 ecr 1726003253], length 572
02:15:24.382450 IP comp3134-Winter2024.ssh > 141.117.117.234.13056: Flags [P.], seq 59100:59136, ack 37, win 501, options [nop,nop,TS val 2951984815 ecr 1726003253], length 36
02:15:24.485531 IP comp3134-Winter2024.ssh > 141.117.117.234.13056: Flags [P.], seq 59136:59348, ack 37, win 501, options [nop,nop,TS val 2951984918 ecr 1726003354], length 212
02:15:24.485760 IP comp3134-Winter2024.ssh > 141.117.117.234.13056: Flags [P.], seq 59348:60096, ack 37, win 501, options [nop,nop,TS val 2951984918 ecr 1726003354], length 748
02:15:24.485892 IP comp3134-Winter2024.ssh > 141.117.117.234.13056: Flags [P.], seq 60096:60668, ack 37, win 501, options [nop,nop,TS val 2951984918 ecr 1726003354], length 572
02:15:24.485988 IP comp3134-Winter2024.ssh > 141.117.117.234.13056: Flags [P.], seq 60668:60888, ack 37, win 501, options [nop,nop,TS val 2951984918 ecr 1726003354], length 220
02:15:24.589538 IP comp3134-Winter2024.ssh > 141.117.117.234.13056: Flags [P.], seq 60888:61100, ack 37, win 501, options [nop,nop,TS val 2951985022 ecr 1726003457], length 212
02:15:24.589758 IP comp3134-Winter2024.ssh > 141.117.117.234.13056: Flags [P.], seq 61100:61672, ack 37, win 501, options [nop,nop,TS val 2951985022 ecr 1726003457], length 572
02:15:24.589822 IP comp3134-Winter2024.ssh > 141.117.117.234.13056: Flags [P.], seq 61672:61708, ack 37, win 501, options [nop,nop,TS val 2951985022 ecr 1726003457], length 36
02:15:24.693489 IP comp3134-Winter2024.ssh > 141.117.117.234.13056: Flags [P.], seq 61708:61920, ack 37, win 501, options [nop,nop,TS val 2951985126 ecr 1726003562], length 212
02:15:24.693632 IP comp3134-Winter2024.ssh > 141.117.117.234.13056: Flags [P.], seq 61920:62316, ack 37, win 501, options [nop,nop,TS val 2951985126 ecr 1726003562], length 396
02:15:24.797508 IP comp3134-Winter2024.ssh > 141.117.117.234.13056: Flags [P.], seq 62316:62528, ack 37, win 501, options [nop,nop,TS val 2951985230 ecr 1726003665], length 212
02:15:24.797654 IP comp3134-Winter2024.ssh > 141.117.117.234.13056: Flags [P.], seq 62528:62748, ack 37, win 501, options [nop,nop,TS val 2951985230 ecr 1726003665], length 220
02:15:24.901496 IP comp3134-Winter2024.ssh > 141.117.117.234.13056: Flags [P.], seq 62748:63136, ack 37, win 501, options [nop,nop,TS val 2951985334 ecr 1726003770], length 388
02:15:24.901724 IP comp3134-Winter2024.ssh > 141.117.117.234.13056: Flags [P.], seq 63136:63172, ack 37, win 501, options [nop,nop,TS val 2951985334 ecr 1726003770], length 36
02:15:24.937103 IP comp3134-Winter2024 > 8.25.82.131: ICMP echo reply, id 4, seq 2, length 64
^Z
[12]+  Stopped                 tcpdump -i eth0 src 143.198.33.235