root@comp3134-Winter2024:~# tcpdump -n -i eth0
tcpdump: verbose output suppressed, use -v[v]... for full protocol decode
listening on eth0, link-type EN10MB (Ethernet), snapshot length 262144 bytes
02:11:39.539259 IP 143.198.33.235.22 > 141.117.117.234.13056: Flags [P.], seq 1909163984:1909164092, ack 3369870326, win 501, options [nop,nop,TS val 2951759972 ecr 1725778496], length 108
02:11:39.539344 IP 143.198.33.235.22 > 141.117.117.234.13056: Flags [P.], seq 108:144, ack 1, win 501, options [nop,nop,TS val 2951759972 ecr 1725778496], length 36
02:11:39.539391 IP 143.198.33.235.22 > 141.117.117.234.13056: Flags [P.], seq 144:196, ack 1, win 501, options [nop,nop,TS val 2951759972 ecr 1725778496], length 52
02:11:39.539435 IP 143.198.33.235.22 > 141.117.117.234.13056: Flags [P.], seq 196:264, ack 1, win 501, options [nop,nop,TS val 2951759972 ecr 1725778496], length 68
02:11:39.539487 IP 143.198.33.235.22 > 141.117.117.234.13056: Flags [P.], seq 264:332, ack 1, win 501, options [nop,nop,TS val 2951759972 ecr 1725778496], length 68
02:11:39.539524 IP 143.198.33.235.22 > 141.117.117.234.13056: Flags [P.], seq 332:368, ack 1, win 501, options [nop,nop,TS val 2951759972 ecr 1725778496], length 36
02:11:39.541038 IP 141.117.117.234.13056 > 143.198.33.235.22: Flags [.], ack 0, win 19151, options [nop,nop,TS val 1725778509 ecr 2951759966], length 0
02:11:39.548154 IP 141.117.117.234.13056 > 143.198.33.235.22: Flags [.], ack 368, win 19146, options [nop,nop,TS val 1725778515 ecr 2951759972], length 0
02:11:39.637640 IP 143.198.33.235.22 > 141.117.117.234.13056: Flags [P.], seq 368:596, ack 1, win 501, options [nop,nop,TS val 2951760070 ecr 1725778515], length 228
02:11:39.637776 IP 143.198.33.235.22 > 141.117.117.234.13056: Flags [P.], seq 596:836, ack 1, win 501, options [nop,nop,TS val 2951760070 ecr 1725778515], length 240
02:11:39.637835 IP 143.198.33.235.22 > 141.117.117.234.13056: Flags [P.], seq 836:872, ack 1, win 501, options [nop,nop,TS val 2951760070 ecr 1725778515], length 36
02:11:39.637918 IP 143.198.33.235.22 > 141.117.117.234.13056: Flags [P.], seq 872:1076, ack 1, win 501, options [nop,nop,TS val 2951760070 ecr 1725778515], length 204
02:11:39.637968 IP 143.198.33.235.22 > 141.117.117.234.13056: Flags [P.], seq 1076:1112, ack 1, win 501, options [nop,nop,TS val 2951760070 ecr 1725778515], length 36
02:11:39.638041 IP 143.198.33.235.22 > 141.117.117.234.13056: Flags [P.], seq 1112:1316, ack 1, win 501, options [nop,nop,TS val 2951760070 ecr 1725778515], length 204
02:11:39.638077 IP 143.198.33.235.22 > 141.117.117.234.13056: Flags [P.], seq 1316:1352, ack 1, win 501, options [nop,nop,TS val 2951760070 ecr 1725778515], length 36
02:11:39.638126 IP 143.198.33.235.22 > 141.117.117.234.13056: Flags [P.], seq 1352:1556, ack 1, win 501, options [nop,nop,TS val 2951760070 ecr 1725778515], length 204
02:11:39.638197 IP 143.198.33.235.22 > 141.117.117.234.13056: Flags [P.], seq 1556:1796, ack 1, win 501, options [nop,nop,TS val 2951760070 ecr 1725778515], length 240
02:11:39.638231 IP 143.198.33.235.22 > 141.117.117.234.13056: Flags [P.], seq 1796:1832, ack 1, win 501, options [nop,nop,TS val 2951760071 ecr 1725778515], length 36
02:11:39.638297 IP 143.198.33.235.22 > 141.117.117.234.13056: Flags [P.], seq 1832:2020, ack 1, win 501, options [nop,nop,TS val 2951760071 ecr 1725778515], length 188
02:11:39.638393 IP 143.198.33.235.22 > 141.117.117.234.13056: Flags [P.], seq 2020:2244, ack 1, win 501, options [nop,nop,TS val 2951760071 ecr 1725778515], length 224
02:11:39.638437 IP 143.198.33.235.22 > 141.117.117.234.13056: Flags [P.], seq 2244:2280, ack 1, win 501, options [nop,nop,TS val 2951760071 ecr 1725778515], length 36
02:11:39.665298 IP 143.198.33.235.22 > 141.117.117.234.13056: Flags [P.], seq 2244:2280, ack 1, win 501, options [nop,nop,TS val 2951760098 ecr 1725778515], length 36
02:11:39.695285 IP 141.117.117.234.13056 > 143.198.33.235.22: Flags [.], ack 2280, win 19122, options [nop,nop,TS val 1725778660 ecr 2951760071], length 0
02:11:39.695285 IP 141.117.117.234.13056 > 143.198.33.235.22: Flags [.], ack 2280, win 19122, options [nop,nop,TS val 1725778660 ecr 2951760098,nop,nop,sack 1 {2244:2280}], length 0
02:11:39.741528 IP 143.198.33.235.22 > 141.117.117.234.13056: Flags [P.], seq 2280:2484, ack 1, win 501, options [nop,nop,TS val 2951760174 ecr 1725778660], length 204
02:11:39.741649 IP 143.198.33.235.22 > 141.117.117.234.13056: Flags [P.], seq 2484:2724, ack 1, win 501, options [nop,nop,TS val 2951760174 ecr 1725778660], length 240
02:11:39.741720 IP 143.198.33.235.22 > 141.117.117.234.13056: Flags [P.], seq 2724:2760, ack 1, win 501, options [nop,nop,TS val 2951760174 ecr 1725778660], length 36
02:11:39.741750 IP 143.198.33.235.22 > 141.117.117.234.13056: Flags [P.], seq 2760:2964, ack 1, win 501, options [nop,nop,TS val 2951760174 ecr 1725778660], length 204
02:11:39.741860 IP 143.198.33.235.22 > 141.117.117.234.13056: Flags [P.], seq 2964:3240, ack 1, win 501, options [nop,nop,TS val 2951760174 ecr 1725778660], length 276
02:11:39.741946 IP 143.198.33.235.22 > 141.117.117.234.13056: Flags [P.], seq 3240:3684, ack 1, win 501, options [nop,nop,TS val 2951760174 ecr 1725778660], length 444
02:11:39.741987 IP 143.198.33.235.22 > 141.117.117.234.13056: Flags [P.], seq 3684:3720, ack 1, win 501, options [nop,nop,TS val 2951760174 ecr 1725778660], length 36
02:11:39.742042 IP 143.198.33.235.22 > 141.117.117.234.13056: Flags [P.], seq 3720:3924, ack 1, win 501, options [nop,nop,TS val 2951760174 ecr 1725778660], length 204
02:11:39.742079 IP 143.198.33.235.22 > 141.117.117.234.13056: Flags [P.], seq 3924:3960, ack 1, win 501, options [nop,nop,TS val 2951760174 ecr 1725778660], length 36
02:11:39.742134 IP 143.198.33.235.22 > 141.117.117.234.13056: Flags [P.], seq 3960:4164, ack 1, win 501, options [nop,nop,TS val 2951760174 ecr 1725778660], length 204
02:11:39.742172 IP 143.198.33.235.22 > 141.117.117.234.13056: Flags [P.], seq 4164:4200, ack 1, win 501, options [nop,nop,TS val 2951760174 ecr 1725778660], length 36
02:11:39.742227 IP 143.198.33.235.22 > 141.117.117.234.13056: Flags [P.], seq 4200:4404, ack 1, win 501, options [nop,nop,TS val 2951760174 ecr 1725778660], length 204
02:11:39.742265 IP 143.198.33.235.22 > 141.117.117.234.13056: Flags [P.], seq 4404:4440, ack 1, win 501, options [nop,nop,TS val 2951760175 ecr 1725778660], length 36
02:11:39.742320 IP 143.198.33.235.22 > 141.117.117.234.13056: Flags [P.], seq 4440:4644, ack 1, win 501, options [nop,nop,TS val 2951760175 ecr 1725778660], length 204
02:11:39.742362 IP 143.198.33.235.22 > 141.117.117.234.13056: Flags [P.], seq 4644:4680, ack 1, win 501, options [nop,nop,TS val 2951760175 ecr 1725778660], length 36
02:11:39.742421 IP 143.198.33.235.22 > 141.117.117.234.13056: Flags [P.], seq 4680:4884, ack 1, win 501, options [nop,nop,TS val 2951760175 ecr 1725778660], length 204
02:11:39.742472 IP 143.198.33.235.22 > 141.117.117.234.13056: Flags [P.], seq 4884:4920, ack 1, win 501, options [nop,nop,TS val 2951760175 ecr 1725778660], length 36
02:11:39.742534 IP 143.198.33.235.22 > 141.117.117.234.13056: Flags [P.], seq 4920:5124, ack 1, win 501, options [nop,nop,TS val 2951760175 ecr 1725778660], length 204
02:11:39.742644 IP 143.198.33.235.22 > 141.117.117.234.13056: Flags [P.], seq 5124:5400, ack 1, win 501, options [nop,nop,TS val 2951760175 ecr 1725778660], length 276
02:11:39.742678 IP 143.198.33.235.22 > 141.117.117.234.13056: Flags [P.], seq 5400:5604, ack 1, win 501, options [nop,nop,TS val 2951760175 ecr 1725778660], length 204
02:11:39.742721 IP 143.198.33.235.22 > 141.117.117.234.13056: Flags [P.], seq 5604:5640, ack 1, win 501, options [nop,nop,TS val 2951760175 ecr 1725778660], length 36
02:11:39.742778 IP 143.198.33.235.22 > 141.117.117.234.13056: Flags [P.], seq 5640:5828, ack 1, win 501, options [nop,nop,TS val 2951760175 ecr 1725778660], length 188
02:11:39.742858 IP 143.198.33.235.22 > 141.117.117.234.13056: Flags [P.], seq 5828:6084, ack 1, win 501, options [nop,nop,TS val 2951760175 ecr 1725778660], length 256
02:11:39.742888 IP 143.198.33.235.22 > 141.117.117.234.13056: Flags [P.], seq 6084:6120, ack 1, win 501, options [nop,nop,TS val 2951760175 ecr 1725778660], length 36
02:11:39.750157 IP 141.117.117.234.13056 > 143.198.33.235.22: Flags [.], ack 4920, win 19111, options [nop,nop,TS val 1725778717 ecr 2951760175], length 0
02:11:39.750994 IP 141.117.117.234.13056 > 143.198.33.235.22: Flags [.], ack 6120, win 19133, options [nop,nop,TS val 1725778720 ecr 2951760175], length 0
02:11:39.845506 IP 143.198.33.235.22 > 141.117.117.234.13056: Flags [P.], seq 6120:6324, ack 1, win 501, options [nop,nop,TS val 2951760278 ecr 1725778720], length 204
02:11:39.845593 IP 143.198.33.235.22 > 141.117.117.234.13056: Flags [P.], seq 6324:6360, ack 1, win 501, options [nop,nop,TS val 2951760278 ecr 1725778720], length 36
02:11:39.845654 IP 143.198.33.235.22 > 141.117.117.234.13056: Flags [P.], seq 6360:6564, ack 1, win 501, options [nop,nop,TS val 2951760278 ecr 1725778720], length 204
02:11:39.845688 IP 143.198.33.235.22 > 141.117.117.234.13056: Flags [P.], seq 6564:6600, ack 1, win 501, options [nop,nop,TS val 2951760278 ecr 1725778720], length 36
02:11:39.845737 IP 143.198.33.235.22 > 141.117.117.234.13056: Flags [P.], seq 6600:6804, ack 1, win 501, options [nop,nop,TS val 2951760278 ecr 1725778720], length 204
02:11:39.845771 IP 143.198.33.235.22 > 141.117.117.234.13056: Flags [P.], seq 6804:6840, ack 1, win 501, options [nop,nop,TS val 2951760278 ecr 1725778720], length 36
02:11:39.845817 IP 143.198.33.235.22 > 141.117.117.234.13056: Flags [P.], seq 6840:7044, ack 1, win 501, options [nop,nop,TS val 2951760278 ecr 1725778720], length 204
02:11:39.845853 IP 143.198.33.235.22 > 141.117.117.234.13056: Flags [P.], seq 7044:7080, ack 1, win 501, options [nop,nop,TS val 2951760278 ecr 1725778720], length 36
02:11:39.845909 IP 143.198.33.235.22 > 141.117.117.234.13056: Flags [P.], seq 7080:7284, ack 1, win 501, options [nop,nop,TS val 2951760278 ecr 1725778720], length 204
02:11:39.845954 IP 143.198.33.235.22 > 141.117.117.234.13056: Flags [P.], seq 7284:7320, ack 1, win 501, options [nop,nop,TS val 2951760278 ecr 1725778720], length 36
02:11:39.846014 IP 143.198.33.235.22 > 141.117.117.234.13056: Flags [P.], seq 7320:7524, ack 1, win 501, options [nop,nop,TS val 2951760278 ecr 1725778720], length 204
02:11:39.846073 IP 143.198.33.235.22 > 141.117.117.234.13056: Flags [P.], seq 7524:7560, ack 1, win 501, options [nop,nop,TS val 2951760278 ecr 1725778720], length 36
02:11:39.846160 IP 143.198.33.235.22 > 141.117.117.234.13056: Flags [P.], seq 7560:7764, ack 1, win 501, options [nop,nop,TS val 2951760278 ecr 1725778720], length 204
02:11:39.846219 IP 143.198.33.235.22 > 141.117.117.234.13056: Flags [P.], seq 7764:7800, ack 1, win 501, options [nop,nop,TS val 2951760278 ecr 1725778720], length 36
02:11:39.846274 IP 143.198.33.235.22 > 141.117.117.234.13056: Flags [P.], seq 7800:8004, ack 1, win 501, options [nop,nop,TS val 2951760279 ecr 1725778720], length 204
02:11:39.846323 IP 143.198.33.235.22 > 141.117.117.234.13056: Flags [P.], seq 8004:8040, ack 1, win 501, options [nop,nop,TS val 2951760279 ecr 1725778720], length 36
02:11:39.846382 IP 143.198.33.235.22 > 141.117.117.234.13056: Flags [P.], seq 8040:8244, ack 1, win 501, options [nop,nop,TS val 2951760279 ecr 1725778720], length 204
02:11:39.846423 IP 143.198.33.235.22 > 141.117.117.234.13056: Flags [P.], seq 8244:8280, ack 1, win 501, options [nop,nop,TS val 2951760279 ecr 1725778720], length 36
02:11:39.846483 IP 143.198.33.235.22 > 141.117.117.234.13056: Flags [P.], seq 8280:8484, ack 1, win 501, options [nop,nop,TS val 2951760279 ecr 1725778720], length 204
02:11:39.846524 IP 143.198.33.235.22 > 141.117.117.234.13056: Flags [P.], seq 8484:8520, ack 1, win 501, options [nop,nop,TS val 2951760279 ecr 1725778720], length 36
02:11:39.846584 IP 143.198.33.235.22 > 141.117.117.234.13056: Flags [P.], seq 8520:8724, ack 1, win 501, options [nop,nop,TS val 2951760279 ecr 1725778720], length 204
02:11:39.846625 IP 143.198.33.235.22 > 141.117.117.234.13056: Flags [P.], seq 8724:8760, ack 1, win 501, options [nop,nop,TS val 2951760279 ecr 1725778720], length 36
02:11:39.846686 IP 143.198.33.235.22 > 141.117.117.234.13056: Flags [P.], seq 8760:8964, ack 1, win 501, options [nop,nop,TS val 2951760279 ecr 1725778720], length 204
02:11:39.846728 IP 143.198.33.235.22 > 141.117.117.234.13056: Flags [P.], seq 8964:9000, ack 1, win 501, options [nop,nop,TS val 2951760279 ecr 1725778720], length 36
02:11:39.846799 IP 143.198.33.235.22 > 141.117.117.234.13056: Flags [P.], seq 9000:9204, ack 1, win 501, options [nop,nop,TS val 2951760279 ecr 1725778720], length 204
02:11:39.846844 IP 143.198.33.235.22 > 141.117.117.234.13056: Flags [P.], seq 9204:9240, ack 1, win 501, options [nop,nop,TS val 2951760279 ecr 1725778720], length 36
02:11:39.846902 IP 143.198.33.235.22 > 141.117.117.234.13056: Flags [P.], seq 9240:9444, ack 1, win 501, options [nop,nop,TS val 2951760279 ecr 1725778720], length 204
02:11:39.846942 IP 143.198.33.235.22 > 141.117.117.234.13056: Flags [P.], seq 9444:9480, ack 1, win 501, options [nop,nop,TS val 2951760279 ecr 1725778720], length 36
02:11:39.847003 IP 143.198.33.235.22 > 141.117.117.234.13056: Flags [P.], seq 9480:9684, ack 1, win 501, options [nop,nop,TS val 2951760279 ecr 1725778720], length 204
02:11:39.847045 IP 143.198.33.235.22 > 141.117.117.234.13056: Flags [P.], seq 9684:9720, ack 1, win 501, options [nop,nop,TS val 2951760279 ecr 1725778720], length 36
02:11:39.847278 IP 143.198.33.235.22 > 141.117.117.234.13056: Flags [P.], seq 9720:9924, ack 1, win 501, options [nop,nop,TS val 2951760280 ecr 1725778720], length 204
02:11:39.847339 IP 143.198.33.235.22 > 141.117.117.234.13056: Flags [P.], seq 9924:9960, ack 1, win 501, options [nop,nop,TS val 2951760280 ecr 1725778720], length 36
02:11:39.847401 IP 143.198.33.235.22 > 141.117.117.234.13056: Flags [P.], seq 9960:10164, ack 1, win 501, options [nop,nop,TS val 2951760280 ecr 1725778720], length 204
02:11:39.847433 IP 143.198.33.235.22 > 141.117.117.234.13056: Flags [P.], seq 10164:10200, ack 1, win 501, options [nop,nop,TS val 2951760280 ecr 1725778720], length 36
02:11:39.847479 IP 143.198.33.235.22 > 141.117.117.234.13056: Flags [P.], seq 10200:10404, ack 1, win 501, options [nop,nop,TS val 2951760280 ecr 1725778720], length 204
02:11:39.847528 IP 143.198.33.235.22 > 141.117.117.234.13056: Flags [P.], seq 10404:10440, ack 1, win 501, options [nop,nop,TS val 2951760280 ecr 1725778720], length 36
02:11:39.847642 IP 143.198.33.235.22 > 141.117.117.234.13056: Flags [P.], seq 10440:10644, ack 1, win 501, options [nop,nop,TS val 2951760280 ecr 1725778720], length 204
02:11:39.847680 IP 143.198.33.235.22 > 141.117.117.234.13056: Flags [P.], seq 10644:10680, ack 1, win 501, options [nop,nop,TS val 2951760280 ecr 1725778720], length 36
02:11:39.847730 IP 143.198.33.235.22 > 141.117.117.234.13056: Flags [P.], seq 10680:10884, ack 1, win 501, options [nop,nop,TS val 2951760280 ecr 1725778720], length 204
02:11:39.847761 IP 143.198.33.235.22 > 141.117.117.234.13056: Flags [P.], seq 10884:10920, ack 1, win 501, options [nop,nop,TS val 2951760280 ecr 1725778720], length 36
02:11:39.847806 IP 143.198.33.235.22 > 141.117.117.234.13056: Flags [P.], seq 10920:11124, ack 1, win 501, options [nop,nop,TS val 2951760280 ecr 1725778720], length 204
02:11:39.847838 IP 143.198.33.235.22 > 141.117.117.234.13056: Flags [P.], seq 11124:11160, ack 1, win 501, options [nop,nop,TS val 2951760280 ecr 1725778720], length 36
02:11:39.847885 IP 143.198.33.235.22 > 141.117.117.234.13056: Flags [P.], seq 11160:11364, ack 1, win 501, options [nop,nop,TS val 2951760280 ecr 1725778720], length 204
02:11:39.847927 IP 143.198.33.235.22 > 141.117.117.234.13056: Flags [P.], seq 11364:11400, ack 1, win 501, options [nop,nop,TS val 2951760280 ecr 1725778720], length 36
02:11:39.847985 IP 143.198.33.235.22 > 141.117.117.234.13056: Flags [P.], seq 11400:11604, ack 1, win 501, options [nop,nop,TS val 2951760280 ecr 1725778720], length 204
02:11:39.848022 IP 143.198.33.235.22 > 141.117.117.234.13056: Flags [P.], seq 11604:11640, ack 1, win 501, options [nop,nop,TS val 2951760280 ecr 1725778720], length 36
02:11:39.848071 IP 143.198.33.235.22 > 141.117.117.234.13056: Flags [P.], seq 11640:11844, ack 1, win 501, options [nop,nop,TS val 2951760280 ecr 1725778720], length 204
02:11:39.848103 IP 143.198.33.235.22 > 141.117.117.234.13056: Flags [P.], seq 11844:11880, ack 1, win 501, options [nop,nop,TS val 2951760280 ecr 1725778720], length 36
02:11:39.848148 IP 143.198.33.235.22 > 141.117.117.234.13056: Flags [P.], seq 11880:12068, ack 1, win 501, options [nop,nop,TS val 2951760280 ecr 1725778720], length 188
02:11:39.848181 IP 143.198.33.235.22 > 141.117.117.234.13056: Flags [P.], seq 12068:12104, ack 1, win 501, options [nop,nop,TS val 2951760280 ecr 1725778720], length 36
02:11:39.848226 IP 143.198.33.235.22 > 141.117.117.234.13056: Flags [P.], seq 12104:12292, ack 1, win 501, options [nop,nop,TS val 2951760280 ecr 1725778720], length 188
02:11:39.848258 IP 143.198.33.235.22 > 141.117.117.234.13056: Flags [P.], seq 12292:12328, ack 1, win 501, options [nop,nop,TS val 2951760281 ecr 1725778720], length 36
02:11:39.855474 IP 141.117.117.234.13056 > 143.198.33.235.22: Flags [.], ack 12328, win 19055, options [nop,nop,TS val 1725778824 ecr 2951760281], length 0
02:11:39.949482 IP 143.198.33.235.22 > 141.117.117.234.13056: Flags [P.], seq 12328:12532, ack 1, win 501, options [nop,nop,TS val 2951760382 ecr 1725778824], length 204
02:11:39.949551 IP 143.198.33.235.22 > 141.117.117.234.13056: Flags [P.], seq 12532:12568, ack 1, win 501, options [nop,nop,TS val 2951760382 ecr 1725778824], length 36
02:11:39.949616 IP 143.198.33.235.22 > 141.117.117.234.13056: Flags [P.], seq 12568:12772, ack 1, win 501, options [nop,nop,TS val 2951760382 ecr 1725778824], length 204
02:11:39.949649 IP 143.198.33.235.22 > 141.117.117.234.13056: Flags [P.], seq 12772:12808, ack 1, win 501, options [nop,nop,TS val 2951760382 ecr 1725778824], length 36
02:11:39.949697 IP 143.198.33.235.22 > 141.117.117.234.13056: Flags [P.], seq 12808:13012, ack 1, win 501, options [nop,nop,TS val 2951760382 ecr 1725778824], length 204
02:11:39.949767 IP 143.198.33.235.22 > 141.117.117.234.13056: Flags [P.], seq 13012:13252, ack 1, win 501, options [nop,nop,TS val 2951760382 ecr 1725778824], length 240
02:11:39.949843 IP 143.198.33.235.22 > 141.117.117.234.13056: Flags [P.], seq 13252:13492, ack 1, win 501, options [nop,nop,TS val 2951760382 ecr 1725778824], length 240
02:11:39.949872 IP 143.198.33.235.22 > 141.117.117.234.13056: Flags [P.], seq 13492:13528, ack 1, win 501, options [nop,nop,TS val 2951760382 ecr 1725778824], length 36
02:11:39.949926 IP 143.198.33.235.22 > 141.117.117.234.13056: Flags [P.], seq 13528:13732, ack 1, win 501, options [nop,nop,TS val 2951760382 ecr 1725778824], length 204
02:11:39.950103 IP 143.198.33.235.22 > 141.117.117.234.13056: Flags [P.], seq 13732:14452, ack 1, win 501, options [nop,nop,TS val 2951760382 ecr 1725778824], length 720
02:11:39.950161 IP 143.198.33.235.22 > 141.117.117.234.13056: Flags [P.], seq 14452:14488, ack 1, win 501, options [nop,nop,TS val 2951760382 ecr 1725778824], length 36
02:11:39.950215 IP 143.198.33.235.22 > 141.117.117.234.13056: Flags [P.], seq 14488:14692, ack 1, win 501, options [nop,nop,TS val 2951760382 ecr 1725778824], length 204
02:11:39.950248 IP 143.198.33.235.22 > 141.117.117.234.13056: Flags [P.], seq 14692:14728, ack 1, win 501, options [nop,nop,TS val 2951760383 ecr 1725778824], length 36
02:11:39.950294 IP 143.198.33.235.22 > 141.117.117.234.13056: Flags [P.], seq 14728:14932, ack 1, win 501, options [nop,nop,TS val 2951760383 ecr 1725778824], length 204
02:11:39.950335 IP 143.198.33.235.22 > 141.117.117.234.13056: Flags [P.], seq 14932:14968, ack 1, win 501, options [nop,nop,TS val 2951760383 ecr 1725778824], length 36
02:11:39.950398 IP 143.198.33.235.22 > 141.117.117.234.13056: Flags [P.], seq 14968:15172, ack 1, win 501, options [nop,nop,TS val 2951760383 ecr 1725778824], length 204
02:11:39.950464 IP 143.198.33.235.22 > 141.117.117.234.13056: Flags [P.], seq 15172:15208, ack 1, win 501, options [nop,nop,TS val 2951760383 ecr 1725778824], length 36
02:11:39.950477 IP 143.198.33.235.22 > 141.117.117.234.13056: Flags [P.], seq 15208:15412, ack 1, win 501, options [nop,nop,TS val 2951760383 ecr 1725778824], length 204
02:11:39.950509 IP 143.198.33.235.22 > 141.117.117.234.13056: Flags [P.], seq 15412:15448, ack 1, win 501, options [nop,nop,TS val 2951760383 ecr 1725778824], length 36
02:11:39.950555 IP 143.198.33.235.22 > 141.117.117.234.13056: Flags [P.], seq 15448:15652, ack 1, win 501, options [nop,nop,TS val 2951760383 ecr 1725778824], length 204
02:11:39.950588 IP 143.198.33.235.22 > 141.117.117.234.13056: Flags [P.], seq 15652:15688, ack 1, win 501, options [nop,nop,TS val 2951760383 ecr 1725778824], length 36
02:11:39.950661 IP 143.198.33.235.22 > 141.117.117.234.13056: Flags [P.], seq 15688:15892, ack 1, win 501, options [nop,nop,TS val 2951760383 ecr 1725778824], length 204
02:11:39.950694 IP 143.198.33.235.22 > 141.117.117.234.13056: Flags [P.], seq 15892:15928, ack 1, win 501, options [nop,nop,TS val 2951760383 ecr 1725778824], length 36
02:11:39.950757 IP 143.198.33.235.22 > 141.117.117.234.13056: Flags [P.], seq 15928:16132, ack 1, win 501, options [nop,nop,TS val 2951760383 ecr 1725778824], length 204
02:11:39.950831 IP 143.198.33.235.22 > 141.117.117.234.13056: Flags [P.], seq 16132:16168, ack 1, win 501, options [nop,nop,TS val 2951760383 ecr 1725778824], length 36
02:11:39.950877 IP 143.198.33.235.22 > 141.117.117.234.13056: Flags [P.], seq 16168:16372, ack 1, win 501, options [nop,nop,TS val 2951760383 ecr 1725778824], length 204
02:11:39.950958 IP 143.198.33.235.22 > 141.117.117.234.13056: Flags [P.], seq 16372:16612, ack 1, win 501, options [nop,nop,TS val 2951760383 ecr 1725778824], length 240
02:11:39.950992 IP 143.198.33.235.22 > 141.117.117.234.13056: Flags [P.], seq 16612:16648, ack 1, win 501, options [nop,nop,TS val 2951760383 ecr 1725778824], length 36
02:11:39.951045 IP 143.198.33.235.22 > 141.117.117.234.13056: Flags [P.], seq 16648:16852, ack 1, win 501, options [nop,nop,TS val 2951760383 ecr 1725778824], length 204
02:11:39.951092 IP 143.198.33.235.22 > 141.117.117.234.13056: Flags [P.], seq 16852:16888, ack 1, win 501, options [nop,nop,TS val 2951760383 ecr 1725778824], length 36
02:11:39.951309 IP 143.198.33.235.22 > 141.117.117.234.13056: Flags [P.], seq 16888:17092, ack 1, win 501, options [nop,nop,TS val 2951760384 ecr 1725778824], length 204
02:11:39.951370 IP 143.198.33.235.22 > 141.117.117.234.13056: Flags [P.], seq 17092:17128, ack 1, win 501, options [nop,nop,TS val 2951760384 ecr 1725778824], length 36
02:11:39.951441 IP 143.198.33.235.22 > 141.117.117.234.13056: Flags [P.], seq 17128:17332, ack 1, win 501, options [nop,nop,TS val 2951760384 ecr 1725778824], length 204
02:11:39.951489 IP 143.198.33.235.22 > 141.117.117.234.13056: Flags [P.], seq 17332:17368, ack 1, win 501, options [nop,nop,TS val 2951760384 ecr 1725778824], length 36
02:11:39.951555 IP 143.198.33.235.22 > 141.117.117.234.13056: Flags [P.], seq 17368:17572, ack 1, win 501, options [nop,nop,TS val 2951760384 ecr 1725778824], length 204
02:11:39.951609 IP 143.198.33.235.22 > 141.117.117.234.13056: Flags [P.], seq 17572:17608, ack 1, win 501, options [nop,nop,TS val 2951760384 ecr 1725778824], length 36
02:11:39.951666 IP 143.198.33.235.22 > 141.117.117.234.13056: Flags [P.], seq 17608:17812, ack 1, win 501, options [nop,nop,TS val 2951760384 ecr 1725778824], length 204
02:11:39.951709 IP 143.198.33.235.22 > 141.117.117.234.13056: Flags [P.], seq 17812:17848, ack 1, win 501, options [nop,nop,TS val 2951760384 ecr 1725778824], length 36
02:11:39.951772 IP 143.198.33.235.22 > 141.117.117.234.13056: Flags [P.], seq 17848:18052, ack 1, win 501, options [nop,nop,TS val 2951760384 ecr 1725778824], length 204
02:11:39.951818 IP 143.198.33.235.22 > 141.117.117.234.13056: Flags [P.], seq 18052:18088, ack 1, win 501, options [nop,nop,TS val 2951760384 ecr 1725778824], length 36
02:11:39.951880 IP 143.198.33.235.22 > 141.117.117.234.13056: Flags [P.], seq 18088:18292, ack 1, win 501, options [nop,nop,TS val 2951760384 ecr 1725778824], length 204
02:11:39.951924 IP 143.198.33.235.22 > 141.117.117.234.13056: Flags [P.], seq 18292:18328, ack 1, win 501, options [nop,nop,TS val 2951760384 ecr 1725778824], length 36
02:11:39.951982 IP 143.198.33.235.22 > 141.117.117.234.13056: Flags [P.], seq 18328:18532, ack 1, win 501, options [nop,nop,TS val 2951760384 ecr 1725778824], length 204
02:11:39.952022 IP 143.198.33.235.22 > 141.117.117.234.13056: Flags [P.], seq 18532:18568, ack 1, win 501, options [nop,nop,TS val 2951760384 ecr 1725778824], length 36
02:11:39.952086 IP 143.198.33.235.22 > 141.117.117.234.13056: Flags [P.], seq 18568:18772, ack 1, win 501, options [nop,nop,TS val 2951760384 ecr 1725778824], length 204
02:11:39.952122 IP 143.198.33.235.22 > 141.117.117.234.13056: Flags [P.], seq 18772:18808, ack 1, win 501, options [nop,nop,TS val 2951760384 ecr 1725778824], length 36
02:11:39.952172 IP 143.198.33.235.22 > 141.117.117.234.13056: Flags [P.], seq 18808:19012, ack 1, win 501, options [nop,nop,TS val 2951760384 ecr 1725778824], length 204
02:11:39.952204 IP 143.198.33.235.22 > 141.117.117.234.13056: Flags [P.], seq 19012:19048, ack 1, win 501, options [nop,nop,TS val 2951760384 ecr 1725778824], length 36
02:11:39.952249 IP 143.198.33.235.22 > 141.117.117.234.13056: Flags [P.], seq 19048:19252, ack 1, win 501, options [nop,nop,TS val 2951760385 ecr 1725778824], length 204
02:11:39.952281 IP 143.198.33.235.22 > 141.117.117.234.13056: Flags [P.], seq 19252:19288, ack 1, win 501, options [nop,nop,TS val 2951760385 ecr 1725778824], length 36
02:11:39.952331 IP 143.198.33.235.22 > 141.117.117.234.13056: Flags [P.], seq 19288:19492, ack 1, win 501, options [nop,nop,TS val 2951760385 ecr 1725778824], length 204
02:11:39.952380 IP 143.198.33.235.22 > 141.117.117.234.13056: Flags [P.], seq 19492:19528, ack 1, win 501, options [nop,nop,TS val 2951760385 ecr 1725778824], length 36
02:11:39.952431 IP 143.198.33.235.22 > 141.117.117.234.13056: Flags [P.], seq 19528:19732, ack 1, win 501, options [nop,nop,TS val 2951760385 ecr 1725778824], length 204
02:11:39.952463 IP 143.198.33.235.22 > 141.117.117.234.13056: Flags [P.], seq 19732:19768, ack 1, win 501, options [nop,nop,TS val 2951760385 ecr 1725778824], length 36
02:11:39.952509 IP 143.198.33.235.22 > 141.117.117.234.13056: Flags [P.], seq 19768:19972, ack 1, win 501, options [nop,nop,TS val 2951760385 ecr 1725778824], length 204
02:11:39.952690 IP 143.198.33.235.22 > 141.117.117.234.13056: Flags [P.], seq 19972:20728, ack 1, win 501, options [nop,nop,TS val 2951760385 ecr 1725778824], length 756
02:11:39.952726 IP 143.198.33.235.22 > 141.117.117.234.13056: Flags [P.], seq 20728:20932, ack 1, win 501, options [nop,nop,TS val 2951760385 ecr 1725778824], length 204
02:11:39.952777 IP 143.198.33.235.22 > 141.117.117.234.13056: Flags [P.], seq 20932:21144, ack 1, win 501, options [nop,nop,TS val 2951760385 ecr 1725778824], length 212
02:11:39.952845 IP 143.198.33.235.22 > 141.117.117.234.13056: Flags [P.], seq 21144:21524, ack 1, win 501, options [nop,nop,TS val 2951760385 ecr 1725778824], length 380
02:11:39.952911 IP 143.198.33.235.22 > 141.117.117.234.13056: Flags [P.], seq 21524:21904, ack 1, win 501, options [nop,nop,TS val 2951760385 ecr 1725778824], length 380
02:11:39.952978 IP 143.198.33.235.22 > 141.117.117.234.13056: Flags [P.], seq 21904:22284, ack 1, win 501, options [nop,nop,TS val 2951760385 ecr 1725778824], length 380
02:11:39.953047 IP 143.198.33.235.22 > 141.117.117.234.13056: Flags [P.], seq 22284:22488, ack 1, win 501, options [nop,nop,TS val 2951760385 ecr 1725778824], length 204
02:11:39.953139 IP 143.198.33.235.22 > 141.117.117.234.13056: Flags [P.], seq 22488:22868, ack 1, win 501, options [nop,nop,TS val 2951760385 ecr 1725778824], length 380
02:11:39.953247 IP 143.198.33.235.22 > 141.117.117.234.13056: Flags [P.], seq 22868:23416, ack 1, win 501, options [nop,nop,TS val 2951760386 ecr 1725778824], length 548
02:11:39.953343 IP 143.198.33.235.22 > 141.117.117.234.13056: Flags [P.], seq 23416:23964, ack 1, win 501, options [nop,nop,TS val 2951760386 ecr 1725778824], length 548
02:11:39.953424 IP 143.198.33.235.22 > 141.117.117.234.13056: Flags [P.], seq 23964:24160, ack 1, win 501, options [nop,nop,TS val 2951760386 ecr 1725778824], length 196
02:11:39.993310 IP 143.198.33.235.22 > 141.117.117.234.13056: Flags [P.], seq 23964:24160, ack 1, win 501, options [nop,nop,TS val 2951760426 ecr 1725778824], length 196
02:11:40.015781 IP 141.117.117.234.13056 > 143.198.33.235.22: Flags [.], ack 24160, win 19152, options [nop,nop,TS val 1725778983 ecr 2951760426], length 0
02:11:40.053471 IP 143.198.33.235.22 > 141.117.117.234.13056: Flags [P.], seq 24160:24364, ack 1, win 501, options [nop,nop,TS val 2951760486 ecr 1725778983], length 204
02:11:40.053616 IP 143.198.33.235.22 > 141.117.117.234.13056: Flags [P.], seq 24364:24912, ack 1, win 501, options [nop,nop,TS val 2951760486 ecr 1725778983], length 548
02:11:40.053769 IP 143.198.33.235.22 > 141.117.117.234.13056: Flags [P.], seq 24912:25804, ack 1, win 501, options [nop,nop,TS val 2951760486 ecr 1725778983], length 892
02:11:40.053875 IP 143.198.33.235.22 > 141.117.117.234.13056: Flags [P.], seq 25804:26184, ack 1, win 501, options [nop,nop,TS val 2951760486 ecr 1725778983], length 380
02:11:40.053986 IP 143.198.33.235.22 > 141.117.117.234.13056: Flags [P.], seq 26184:26900, ack 1, win 501, options [nop,nop,TS val 2951760486 ecr 1725778983], length 716
02:11:40.054045 IP 143.198.33.235.22 > 141.117.117.234.13056: Flags [P.], seq 26900:27280, ack 1, win 501, options [nop,nop,TS val 2951760486 ecr 1725778983], length 380
02:11:40.054109 IP 143.198.33.235.22 > 141.117.117.234.13056: Flags [P.], seq 27280:27828, ack 1, win 501, options [nop,nop,TS val 2951760486 ecr 1725778983], length 548
02:11:40.054162 IP 143.198.33.235.22 > 141.117.117.234.13056: Flags [P.], seq 27828:28208, ack 1, win 501, options [nop,nop,TS val 2951760486 ecr 1725778983], length 380
02:11:40.054225 IP 143.198.33.235.22 > 141.117.117.234.13056: Flags [P.], seq 28208:28756, ack 1, win 501, options [nop,nop,TS val 2951760486 ecr 1725778983], length 548
02:11:40.054277 IP 143.198.33.235.22 > 141.117.117.234.13056: Flags [P.], seq 28756:29136, ack 1, win 501, options [nop,nop,TS val 2951760487 ecr 1725778983], length 380
02:11:40.054331 IP 143.198.33.235.22 > 141.117.117.234.13056: Flags [P.], seq 29136:29516, ack 1, win 501, options [nop,nop,TS val 2951760487 ecr 1725778983], length 380
02:11:40.054394 IP 143.198.33.235.22 > 141.117.117.234.13056: Flags [P.], seq 29516:30064, ack 1, win 501, options [nop,nop,TS val 2951760487 ecr 1725778983], length 548
02:11:40.054447 IP 143.198.33.235.22 > 141.117.117.234.13056: Flags [P.], seq 30064:30444, ack 1, win 501, options [nop,nop,TS val 2951760487 ecr 1725778983], length 380
02:11:40.054510 IP 143.198.33.235.22 > 141.117.117.234.13056: Flags [P.], seq 30444:30992, ack 1, win 501, options [nop,nop,TS val 2951760487 ecr 1725778983], length 548
02:11:40.054576 IP 143.198.33.235.22 > 141.117.117.234.13056: Flags [P.], seq 30992:31372, ack 1, win 501, options [nop,nop,TS val 2951760487 ecr 1725778983], length 380
02:11:40.054675 IP 143.198.33.235.22 > 141.117.117.234.13056: Flags [P.], seq 31372:31920, ack 1, win 501, options [nop,nop,TS val 2951760487 ecr 1725778983], length 548
02:11:40.054770 IP 143.198.33.235.22 > 141.117.117.234.13056: Flags [P.], seq 31920:32300, ack 1, win 501, options [nop,nop,TS val 2951760487 ecr 1725778983], length 380
02:11:40.054850 IP 143.198.33.235.22 > 141.117.117.234.13056: Flags [P.], seq 32300:32680, ack 1, win 501, options [nop,nop,TS val 2951760487 ecr 1725778983], length 380
02:11:40.054934 IP 143.198.33.235.22 > 141.117.117.234.13056: Flags [P.], seq 32680:33060, ack 1, win 501, options [nop,nop,TS val 2951760487 ecr 1725778983], length 380
02:11:40.054999 IP 143.198.33.235.22 > 141.117.117.234.13056: Flags [P.], seq 33060:33440, ack 1, win 501, options [nop,nop,TS val 2951760487 ecr 1725778983], length 380
02:11:40.055063 IP 143.198.33.235.22 > 141.117.117.234.13056: Flags [P.], seq 33440:33652, ack 1, win 501, options [nop,nop,TS val 2951760487 ecr 1725778983], length 212
02:11:40.055220 IP 143.198.33.235.22 > 141.117.117.234.13056: Flags [P.], seq 33652:33856, ack 1, win 501, options [nop,nop,TS val 2951760487 ecr 1725778983], length 204
02:11:40.055258 IP 143.198.33.235.22 > 141.117.117.234.13056: Flags [P.], seq 33856:33892, ack 1, win 501, options [nop,nop,TS val 2951760488 ecr 1725778983], length 36
02:11:40.055311 IP 143.198.33.235.22 > 141.117.117.234.13056: Flags [P.], seq 33892:34096, ack 1, win 501, options [nop,nop,TS val 2951760488 ecr 1725778983], length 204
02:11:40.055343 IP 143.198.33.235.22 > 141.117.117.234.13056: Flags [P.], seq 34096:34132, ack 1, win 501, options [nop,nop,TS val 2951760488 ecr 1725778983], length 36
02:11:40.055388 IP 143.198.33.235.22 > 141.117.117.234.13056: Flags [P.], seq 34132:34336, ack 1, win 501, options [nop,nop,TS val 2951760488 ecr 1725778983], length 204
02:11:40.055438 IP 143.198.33.235.22 > 141.117.117.234.13056: Flags [P.], seq 34336:34548, ack 1, win 501, options [nop,nop,TS val 2951760488 ecr 1725778983], length 212
02:11:40.055504 IP 143.198.33.235.22 > 141.117.117.234.13056: Flags [P.], seq 34548:34928, ack 1, win 501, options [nop,nop,TS val 2951760488 ecr 1725778983], length 380
02:11:40.055569 IP 143.198.33.235.22 > 141.117.117.234.13056: Flags [P.], seq 34928:35308, ack 1, win 501, options [nop,nop,TS val 2951760488 ecr 1725778983], length 380
02:11:40.055634 IP 143.198.33.235.22 > 141.117.117.234.13056: Flags [P.], seq 35308:35688, ack 1, win 501, options [nop,nop,TS val 2951760488 ecr 1725778983], length 380
02:11:40.055700 IP 143.198.33.235.22 > 141.117.117.234.13056: Flags [P.], seq 35688:36068, ack 1, win 501, options [nop,nop,TS val 2951760488 ecr 1725778983], length 380
02:11:40.055765 IP 143.198.33.235.22 > 141.117.117.234.13056: Flags [P.], seq 36068:36448, ack 1, win 501, options [nop,nop,TS val 2951760488 ecr 1725778983], length 380
02:11:40.055831 IP 143.198.33.235.22 > 141.117.117.234.13056: Flags [P.], seq 36448:36828, ack 1, win 501, options [nop,nop,TS val 2951760488 ecr 1725778983], length 380
02:11:40.055903 IP 143.198.33.235.22 > 141.117.117.234.13056: Flags [P.], seq 36828:37024, ack 1, win 501, options [nop,nop,TS val 2951760488 ecr 1725778983], length 196
02:11:40.061485 IP 141.117.117.234.13056 > 143.198.33.235.22: Flags [.], ack 37024, win 19152, options [nop,nop,TS val 1725779029 ecr 2951760488], length 0
02:11:40.157507 IP 143.198.33.235.22 > 141.117.117.234.13056: Flags [P.], seq 37024:37228, ack 1, win 501, options [nop,nop,TS val 2951760590 ecr 1725779029], length 204
02:11:40.157639 IP 143.198.33.235.22 > 141.117.117.234.13056: Flags [P.], seq 37228:37608, ack 1, win 501, options [nop,nop,TS val 2951760590 ecr 1725779029], length 380
02:11:40.157717 IP 143.198.33.235.22 > 141.117.117.234.13056: Flags [P.], seq 37608:37820, ack 1, win 501, options [nop,nop,TS val 2951760590 ecr 1725779029], length 212
02:11:40.157797 IP 143.198.33.235.22 > 141.117.117.234.13056: Flags [P.], seq 37820:38200, ack 1, win 501, options [nop,nop,TS val 2951760590 ecr 1725779029], length 380
02:11:40.157894 IP 143.198.33.235.22 > 141.117.117.234.13056: Flags [P.], seq 38200:38748, ack 1, win 501, options [nop,nop,TS val 2951760590 ecr 1725779029], length 548
02:11:40.157967 IP 143.198.33.235.22 > 141.117.117.234.13056: Flags [P.], seq 38748:39128, ack 1, win 501, options [nop,nop,TS val 2951760590 ecr 1725779029], length 380
02:11:40.158039 IP 143.198.33.235.22 > 141.117.117.234.13056: Flags [P.], seq 39128:39508, ack 1, win 501, options [nop,nop,TS val 2951760590 ecr 1725779029], length 380
02:11:40.158111 IP 143.198.33.235.22 > 141.117.117.234.13056: Flags [P.], seq 39508:39888, ack 1, win 501, options [nop,nop,TS val 2951760590 ecr 1725779029], length 380
02:11:40.158183 IP 143.198.33.235.22 > 141.117.117.234.13056: Flags [P.], seq 39888:40268, ack 1, win 501, options [nop,nop,TS val 2951760590 ecr 1725779029], length 380
02:11:40.158256 IP 143.198.33.235.22 > 141.117.117.234.13056: Flags [P.], seq 40268:40648, ack 1, win 501, options [nop,nop,TS val 2951760591 ecr 1725779029], length 380
02:11:40.158345 IP 143.198.33.235.22 > 141.117.117.234.13056: Flags [P.], seq 40648:41028, ack 1, win 501, options [nop,nop,TS val 2951760591 ecr 1725779029], length 380
02:11:40.158444 IP 143.198.33.235.22 > 141.117.117.234.13056: Flags [P.], seq 41028:41576, ack 1, win 501, options [nop,nop,TS val 2951760591 ecr 1725779029], length 548
02:11:40.158530 IP 143.198.33.235.22 > 141.117.117.234.13056: Flags [P.], seq 41576:42124, ack 1, win 501, options [nop,nop,TS val 2951760591 ecr 1725779029], length 548
02:11:40.158599 IP 143.198.33.235.22 > 141.117.117.234.13056: Flags [P.], seq 42124:42504, ack 1, win 501, options [nop,nop,TS val 2951760591 ecr 1725779029], length 380
02:11:40.158667 IP 143.198.33.235.22 > 141.117.117.234.13056: Flags [P.], seq 42504:42716, ack 1, win 501, options [nop,nop,TS val 2951760591 ecr 1725779029], length 212
02:11:40.158741 IP 143.198.33.235.22 > 141.117.117.234.13056: Flags [P.], seq 42716:43096, ack 1, win 501, options [nop,nop,TS val 2951760591 ecr 1725779029], length 380
02:11:40.158815 IP 143.198.33.235.22 > 141.117.117.234.13056: Flags [P.], seq 43096:43476, ack 1, win 501, options [nop,nop,TS val 2951760591 ecr 1725779029], length 380
02:11:40.158880 IP 143.198.33.235.22 > 141.117.117.234.13056: Flags [P.], seq 43476:43672, ack 1, win 501, options [nop,nop,TS val 2951760591 ecr 1725779029], length 196
02:11:40.197313 IP 143.198.33.235.22 > 141.117.117.234.13056: Flags [P.], seq 43476:43672, ack 1, win 501, options [nop,nop,TS val 2951760630 ecr 1725779029], length 196
02:11:40.211572 IP 141.117.117.234.13056 > 143.198.33.235.22: Flags [.], ack 43672, win 19048, options [nop,nop,TS val 1725779181 ecr 2951760591], length 0
02:11:40.211572 IP 141.117.117.234.13056 > 143.198.33.235.22: Flags [.], ack 43672, win 19048, options [nop,nop,TS val 1725779181 ecr 2951760630,nop,nop,sack 1 {43476:43672}], length 0
02:11:40.212708 IP 141.117.117.234.13056 > 143.198.33.235.22: Flags [.], ack 43672, win 19152, options [nop,nop,TS val 1725779181 ecr 2951760630], length 0
02:11:40.261501 IP 143.198.33.235.22 > 141.117.117.234.13056: Flags [P.], seq 43672:43876, ack 1, win 501, options [nop,nop,TS val 2951760694 ecr 1725779181], length 204
02:11:40.261663 IP 143.198.33.235.22 > 141.117.117.234.13056: Flags [P.], seq 43876:44424, ack 1, win 501, options [nop,nop,TS val 2951760694 ecr 1725779181], length 548
02:11:40.261762 IP 143.198.33.235.22 > 141.117.117.234.13056: Flags [P.], seq 44424:44972, ack 1, win 501, options [nop,nop,TS val 2951760694 ecr 1725779181], length 548
02:11:40.261852 IP 143.198.33.235.22 > 141.117.117.234.13056: Flags [P.], seq 44972:45184, ack 1, win 501, options [nop,nop,TS val 2951760694 ecr 1725779181], length 212
02:11:40.261941 IP 143.198.33.235.22 > 141.117.117.234.13056: Flags [P.], seq 45184:45564, ack 1, win 501, options [nop,nop,TS val 2951760694 ecr 1725779181], length 380
02:11:40.262031 IP 143.198.33.235.22 > 141.117.117.234.13056: Flags [P.], seq 45564:46112, ack 1, win 501, options [nop,nop,TS val 2951760694 ecr 1725779181], length 548
02:11:40.262102 IP 143.198.33.235.22 > 141.117.117.234.13056: Flags [P.], seq 46112:46492, ack 1, win 501, options [nop,nop,TS val 2951760694 ecr 1725779181], length 380
02:11:40.262170 IP 143.198.33.235.22 > 141.117.117.234.13056: Flags [P.], seq 46492:46872, ack 1, win 501, options [nop,nop,TS val 2951760694 ecr 1725779181], length 380
02:11:40.262236 IP 143.198.33.235.22 > 141.117.117.234.13056: Flags [P.], seq 46872:47252, ack 1, win 501, options [nop,nop,TS val 2951760695 ecr 1725779181], length 380
02:11:40.262307 IP 143.198.33.235.22 > 141.117.117.234.13056: Flags [P.], seq 47252:47632, ack 1, win 501, options [nop,nop,TS val 2951760695 ecr 1725779181], length 380
02:11:40.262386 IP 143.198.33.235.22 > 141.117.117.234.13056: Flags [P.], seq 47632:47828, ack 1, win 501, options [nop,nop,TS val 2951760695 ecr 1725779181], length 196
02:11:40.272184 IP 141.117.117.234.13056 > 143.198.33.235.22: Flags [.], ack 47828, win 19152, options [nop,nop,TS val 1725779239 ecr 2951760695], length 0
02:11:40.365436 IP 143.198.33.235.22 > 141.117.117.234.13056: Flags [P.], seq 47828:48032, ack 1, win 501, options [nop,nop,TS val 2951760798 ecr 1725779239], length 204
02:11:40.365591 IP 143.198.33.235.22 > 141.117.117.234.13056: Flags [P.], seq 48032:48924, ack 1, win 501, options [nop,nop,TS val 2951760798 ecr 1725779239], length 892
02:11:40.365684 IP 143.198.33.235.22 > 141.117.117.234.13056: Flags [P.], seq 48924:49472, ack 1, win 501, options [nop,nop,TS val 2951760798 ecr 1725779239], length 548
02:11:40.365756 IP 143.198.33.235.22 > 141.117.117.234.13056: Flags [P.], seq 49472:49852, ack 1, win 501, options [nop,nop,TS val 2951760798 ecr 1725779239], length 380
02:11:40.365831 IP 143.198.33.235.22 > 141.117.117.234.13056: Flags [P.], seq 49852:50048, ack 1, win 501, options [nop,nop,TS val 2951760798 ecr 1725779239], length 196
02:11:40.372091 IP 141.117.117.234.13056 > 143.198.33.235.22: Flags [.], ack 50048, win 19152, options [nop,nop,TS val 1725779340 ecr 2951760798], length 0
02:11:40.469522 IP 143.198.33.235.22 > 141.117.117.234.13056: Flags [P.], seq 50048:50252, ack 1, win 501, options [nop,nop,TS val 2951760902 ecr 1725779340], length 204
02:11:40.469642 IP 143.198.33.235.22 > 141.117.117.234.13056: Flags [P.], seq 50252:50632, ack 1, win 501, options [nop,nop,TS val 2951760902 ecr 1725779340], length 380
02:11:40.469721 IP 143.198.33.235.22 > 141.117.117.234.13056: Flags [P.], seq 50632:51012, ack 1, win 501, options [nop,nop,TS val 2951760902 ecr 1725779340], length 380
02:11:40.469788 IP 143.198.33.235.22 > 141.117.117.234.13056: Flags [P.], seq 51012:51208, ack 1, win 501, options [nop,nop,TS val 2951760902 ecr 1725779340], length 196
02:11:40.513322 IP 143.198.33.235.22 > 141.117.117.234.13056: Flags [P.], seq 51012:51208, ack 1, win 501, options [nop,nop,TS val 2951760946 ecr 1725779340], length 196
02:11:40.542608 IP 141.117.117.234.13056 > 143.198.33.235.22: Flags [.], ack 51208, win 19134, options [nop,nop,TS val 1725779510 ecr 2951760902,nop,nop,sack 1 {51012:51208}], length 0
02:11:40.573646 IP 143.198.33.235.22 > 141.117.117.234.13056: Flags [P.], seq 51208:51412, ack 1, win 501, options [nop,nop,TS val 2951761006 ecr 1725779510], length 204
02:11:40.573830 IP 143.198.33.235.22 > 141.117.117.234.13056: Flags [P.], seq 51412:52320, ack 1, win 501, options [nop,nop,TS val 2951761006 ecr 1725779510], length 908
02:11:40.573882 IP 143.198.33.235.22 > 141.117.117.234.13056: Flags [P.], seq 52320:52356, ack 1, win 501, options [nop,nop,TS val 2951761006 ecr 1725779510], length 36
02:11:40.581047 IP 141.117.117.234.13056 > 143.198.33.235.22: Flags [.], ack 52356, win 19134, options [nop,nop,TS val 1725779549 ecr 2951761006], length 0
02:11:40.677522 IP 143.198.33.235.22 > 141.117.117.234.13056: Flags [P.], seq 52356:52560, ack 1, win 501, options [nop,nop,TS val 2951761110 ecr 1725779549], length 204
02:11:40.677696 IP 143.198.33.235.22 > 141.117.117.234.13056: Flags [P.], seq 52560:53100, ack 1, win 501, options [nop,nop,TS val 2951761110 ecr 1725779549], length 540
02:11:40.731493 IP 141.117.117.234.13056 > 143.198.33.235.22: Flags [.], ack 53100, win 19140, options [nop,nop,TS val 1725779700 ecr 2951761110], length 0
02:11:40.781578 IP 143.198.33.235.22 > 141.117.117.234.13056: Flags [P.], seq 53100:53304, ack 1, win 501, options [nop,nop,TS val 2951761214 ecr 1725779700], length 204
02:11:40.781687 IP 143.198.33.235.22 > 141.117.117.234.13056: Flags [P.], seq 53304:53516, ack 1, win 501, options [nop,nop,TS val 2951761214 ecr 1725779700], length 212
02:11:40.781769 IP 143.198.33.235.22 > 141.117.117.234.13056: Flags [P.], seq 53516:53712, ack 1, win 501, options [nop,nop,TS val 2951761214 ecr 1725779700], length 196
02:11:40.792462 IP 141.117.117.234.13056 > 143.198.33.235.22: Flags [.], ack 53712, win 19142, options [nop,nop,TS val 1725779759 ecr 2951761214], length 0
02:11:40.885550 IP 143.198.33.235.22 > 141.117.117.234.13056: Flags [P.], seq 53712:53916, ack 1, win 501, options [nop,nop,TS val 2951761318 ecr 1725779759], length 204
02:11:40.885716 IP 143.198.33.235.22 > 141.117.117.234.13056: Flags [P.], seq 53916:54456, ack 1, win 501, options [nop,nop,TS val 2951761318 ecr 1725779759], length 540
02:11:40.891472 IP 141.117.117.234.13056 > 143.198.33.235.22: Flags [.], ack 54456, win 19152, options [nop,nop,TS val 1725779860 ecr 2951761318], length 0
02:11:40.891889 IP 141.117.117.234.13056 > 143.198.33.235.22: Flags [P.], seq 1:37, ack 54456, win 19152, options [nop,nop,TS val 1725779860 ecr 2951761318], length 36
02:11:40.933315 IP 143.198.33.235.22 > 141.117.117.234.13056: Flags [.], ack 37, win 501, options [nop,nop,TS val 2951761366 ecr 1725779860], length 0
02:11:40.989550 IP 143.198.33.235.22 > 141.117.117.234.13056: Flags [P.], seq 54456:55316, ack 37, win 501, options [nop,nop,TS val 2951761422 ecr 1725779860], length 860
02:11:41.065333 IP 141.117.117.234.13056 > 143.198.33.235.22: Flags [.], ack 55316, win 19152, options [nop,nop,TS val 1725780033 ecr 2951761422], length 0
02:11:41.093516 IP 143.198.33.235.22 > 141.117.117.234.13056: Flags [P.], seq 55316:55680, ack 37, win 501, options [nop,nop,TS val 2951761526 ecr 1725780033], length 364
02:11:41.101357 IP 141.117.117.234.13056 > 143.198.33.235.22: Flags [.], ack 55680, win 19152, options [nop,nop,TS val 1725780069 ecr 2951761526], length 0
02:11:41.197548 IP 143.198.33.235.22 > 141.117.117.234.13056: Flags [P.], seq 55680:55884, ack 37, win 501, options [nop,nop,TS val 2951761630 ecr 1725780069], length 204
02:11:41.197768 IP 143.198.33.235.22 > 141.117.117.234.13056: Flags [P.], seq 55884:56080, ack 37, win 501, options [nop,nop,TS val 2951761630 ecr 1725780069], length 196
02:11:41.261315 IP 143.198.33.235.22 > 141.117.117.234.13056: Flags [P.], seq 55884:56080, ack 37, win 501, options [nop,nop,TS val 2951761694 ecr 1725780069], length 196
02:11:41.261928 IP 141.117.117.234.13056 > 143.198.33.235.22: Flags [.], ack 56080, win 19152, options [nop,nop,TS val 1725780229 ecr 2951761630], length 0
02:11:41.269695 IP 141.117.117.234.13056 > 143.198.33.235.22: Flags [.], ack 56080, win 19152, options [nop,nop,TS val 1725780238 ecr 2951761694,nop,nop,sack 1 {55884:56080}], length 0
^Z
[8]+  Stopped                 tcpdump -n -i eth0

